collector_number,name,mana_cost,cmc,type_line,rarity,colors,color_identity,oracle_text,power,toughness,loyalty,keywords,set_name,released_at,scryfall_uri
157,Lightshell Duo,{3}{U},4.0,Creature — Rat Otter,common,U,U,"Prowess (Whenever you cast a noncreature spell, this creature gets +1/+1 until end of turn.)
When this creature enters, surveil 2. (Look at the top two cards of your library, then put any number of them into your graveyard and the rest on top of your library in any order.)",3,4,,"Surveil, Prowess",Foundations,2024-11-15,https://scryfall.com/card/fdn/157/lightshell-duo?utm_source=api
158,Micromancer,{3}{U},4.0,Creature — Human Wizard,uncommon,U,U,"When this creature enters, you may search your library for an instant or sorcery card with mana value 1, reveal it, put it into your hand, then shuffle.",3,3,,,Foundations,2024-11-15,https://scryfall.com/card/fdn/158/micromancer?utm_source=api
159,Mocking Sprite,{2}{U},3.0,Creature — Faerie Rogue,common,U,U,"Flying
Instant and sorcery spells you cast cost {1} less to cast.",2,1,,Flying,Foundations,2024-11-15,https://scryfall.com/card/fdn/159/mocking-sprite?utm_source=api
160,An Offer You Can't Refuse,{U},1.0,Instant,uncommon,U,U,"Counter target noncreature spell. Its controller creates two Treasure tokens. (They're artifacts with ""{T}, Sacrifice this token: Add one mana of any color."")",,,,Treasure,Foundations,2024-11-15,https://scryfall.com/card/fdn/160/an-offer-you-cant-refuse?utm_source=api
161,Omniscience,{7}{U}{U}{U},10.0,Enchantment,mythic,U,U,You may cast spells from your hand without paying their mana costs.,,,,,Foundations,2024-11-15,https://scryfall.com/card/fdn/161/omniscience?utm_source=api
162,Run Away Together,{1}{U},2.0,Instant,common,U,U,Choose two target creatures controlled by different players. Return those creatures to their owners' hands.,,,,,Foundations,2024-11-15,https://scryfall.com/card/fdn/162/run-away-together?utm_source=api
163,Self-Reflection,{4}{U}{U},6.0,Sorcery,uncommon,U,U,"Create a token that's a copy of target creature you control.
Flashback {3}{U} (You may cast this card from your graveyard for its flashback cost. Then exile it.)",,,,Flashback,Foundations,2024-11-15,https://scryfall.com/card/fdn/163/self-reflection?utm_source=api
164,Spectral Sailor,{U},1.0,Creature — Spirit Pirate,uncommon,U,U,"Flash (You may cast this spell any time you could cast an instant.)
Flying
{3}{U}: Draw a card.",1,1,,"Flying, Flash",Foundations,2024-11-15,https://scryfall.com/card/fdn/164/spectral-sailor?utm_source=api
165,Think Twice,{1}{U},2.0,Instant,common,U,U,"Draw a card.
Flashback {2}{U} (You may cast this card from your graveyard for its flashback cost. Then exile it.)",,,,Flashback,Foundations,2024-11-15,https://scryfall.com/card/fdn/165/think-twice?utm_source=api
166,Time Stop,{4}{U}{U},6.0,Instant,rare,U,U,"End the turn. (Exile all spells and abilities, including this spell. The player whose turn it is discards down to their maximum hand size. Damage heals and ""this turn"" and ""until end of turn"" effects end.)",,,,,Foundations,2024-11-15,https://scryfall.com/card/fdn/166/time-stop?utm_source=api
167,Tolarian Terror,{6}{U},7.0,Creature — Serpent,common,U,U,"This spell costs {1} less to cast for each instant and sorcery card in your graveyard.
Ward {2} (Whenever this creature becomes the target of a spell or ability an opponent controls, counter it unless that player pays {2}.)",5,5,,Ward,Foundations,2024-11-15,https://scryfall.com/card/fdn/167/tolarian-terror?utm_source=api
168,Witness Protection,{U},1.0,Enchantment — Aura,common,U,U,"Enchant creature
Enchanted creature loses all abilities and is a green and white Citizen creature with base power and toughness 1/1 named Legitimate Businessperson. (It loses all other colors, card types, creature types, and names.)",,,,Enchant,Foundations,2024-11-15,https://scryfall.com/card/fdn/168/witness-protection?utm_source=api
169,Bake into a Pie,{2}{B}{B},4.0,Instant,common,B,B,"Destroy target creature. Create a Food token. (It's an artifact with ""{2}, {T}, Sacrifice this token: You gain 3 life."")",,,,Food,Foundations,2024-11-15,https://scryfall.com/card/fdn/169/bake-into-a-pie?utm_source=api
170,Burglar Rat,{1}{B},2.0,Creature — Rat,common,B,B,"When this creature enters, each opponent discards a card.",1,1,,,Foundations,2024-11-15,https://scryfall.com/card/fdn/170/burglar-rat?utm_source=api
171,Diregraf Ghoul,{B},1.0,Creature — Zombie,uncommon,B,B,This creature enters tapped.,2,2,,,Foundations,2024-11-15,https://scryfall.com/card/fdn/171/diregraf-ghoul?utm_source=api
172,Eaten Alive,{B},1.0,Sorcery,common,B,B,"As an additional cost to cast this spell, sacrifice a creature or pay {3}{B}.
Exile target creature or planeswalker.",,,,,Foundations,2024-11-15,https://scryfall.com/card/fdn/172/eaten-alive?utm_source=api
173,Exsanguinate,{X}{B}{B},2.0,Sorcery,uncommon,B,B,Each opponent loses X life. You gain life equal to the life lost this way.,,,,,Foundations,2024-11-15,https://scryfall.com/card/fdn/173/exsanguinate?utm_source=api
174,Fake Your Own Death,{1}{B},2.0,Instant,common,B,B,"Until end of turn, target creature gets +2/+0 and gains ""When this creature dies, return it to the battlefield tapped under its owner's control and you create a Treasure token."" (It's an artifact with ""{T}, Sacrifice this token: Add one mana of any color."")",,,,Treasure,Foundations,2024-11-15,https://scryfall.com/card/fdn/174/fake-your-own-death?utm_source=api
175,Hero's Downfall,{1}{B}{B},3.0,Instant,uncommon,B,B,Destroy target creature or planeswalker.,,,,,Foundations,2024-11-15,https://scryfall.com/card/fdn/175/heros-downfall?utm_source=api
176,"Liliana, Dreadhorde General",{4}{B}{B},6.0,Legendary Planeswalker — Liliana,mythic,B,B,"Whenever a creature you control dies, draw a card.
+1: Create a 2/2 black Zombie creature token.
−4: Each player sacrifices two creatures of their choice.
−9: Each opponent chooses a permanent they control of each permanent type and sacrifices the rest.",,,6,,Foundations,2024-11-15,https://scryfall.com/card/fdn/176/liliana-dreadhorde-general?utm_source=api
177,Macabre Waltz,{1}{B},2.0,Sorcery,common,B,B,"Return up to two target creature cards from your graveyard to your hand, then discard a card.",,,,,Foundations,2024-11-15,https://scryfall.com/card/fdn/177/macabre-waltz?utm_source=api
178,Marauding Blight-Priest,{2}{B},3.0,Creature — Vampire Cleric,common,B,B,"Whenever you gain life, each opponent loses 1 life.",3,2,,,Foundations,2024-11-15,https://scryfall.com/card/fdn/178/marauding-blight-priest?utm_source=api
179,Painful Quandary,{3}{B}{B},5.0,Enchantment,rare,B,B,"Whenever an opponent casts a spell, that player loses 5 life unless they discard a card.",,,,,Foundations,2024-11-15,https://scryfall.com/card/fdn/179/painful-quandary?utm_source=api
180,Phyrexian Arena,{1}{B}{B},3.0,Enchantment,rare,B,B,"At the beginning of your upkeep, you draw a card and you lose 1 life.",,,,,Foundations,2024-11-15,https://scryfall.com/card/fdn/180/phyrexian-arena?utm_source=api
181,Pilfer,{1}{B},2.0,Sorcery,common,B,B,Target opponent reveals their hand. You choose a nonland card from it. That player discards that card.,,,,,Foundations,2024-11-15,https://scryfall.com/card/fdn/181/pilfer?utm_source=api
182,Reassembling Skeleton,{1}{B},2.0,Creature — Skeleton Warrior,uncommon,B,B,{1}{B}: Return this card from your graveyard to the battlefield tapped.,1,1,,,Foundations,2024-11-15,https://scryfall.com/card/fdn/182/reassembling-skeleton?utm_source=api
183,Rise of the Dark Realms,{7}{B}{B},9.0,Sorcery,mythic,B,B,Put all creature cards from all graveyards onto the battlefield under your control.,,,,,Foundations,2024-11-15,https://scryfall.com/card/fdn/183/rise-of-the-dark-realms?utm_source=api
184,Rune-Scarred Demon,{5}{B}{B},7.0,Creature — Demon,rare,B,B,"Flying
When this creature enters, search your library for a card, put it into your hand, then shuffle.",6,6,,Flying,Foundations,2024-11-15,https://scryfall.com/card/fdn/184/rune-scarred-demon?utm_source=api
185,Stromkirk Bloodthief,{2}{B},3.0,Creature — Vampire Rogue,uncommon,B,B,"At the beginning of your end step, if an opponent lost life this turn, put a +1/+1 counter on target Vampire you control.",2,2,,,Foundations,2024-11-15,https://scryfall.com/card/fdn/185/stromkirk-bloodthief?utm_source=api
186,Vampire Nighthawk,{1}{B}{B},3.0,Creature — Vampire Shaman,uncommon,B,B,"Flying
Deathtouch (Any amount of damage this deals to a creature is enough to destroy it.)
Lifelink (Damage dealt by this creature also causes you to gain that much life.)",2,3,,"Deathtouch, Flying, Lifelink",Foundations,2024-11-15,https://scryfall.com/card/fdn/186/vampire-nighthawk?utm_source=api
187,Zombify,{3}{B},4.0,Sorcery,uncommon,B,B,Return target creature card from your graveyard to the battlefield.,,,,,Foundations,2024-11-15,https://scryfall.com/card/fdn/187/zombify?utm_source=api
188,Abrade,{1}{R},2.0,Instant,uncommon,R,R,"Choose one —
• Abrade deals 3 damage to target creature.
• Destroy target artifact.",,,,,Foundations,2024-11-15,https://scryfall.com/card/fdn/188/abrade?utm_source=api
189,Axgard Cavalry,{1}{R},2.0,Creature — Dwarf Berserker,common,R,R,{T}: Target creature gains haste until end of turn. (It can attack and {T} this turn.),2,2,,,Foundations,2024-11-15,https://scryfall.com/card/fdn/189/axgard-cavalry?utm_source=api
190,Brass's Bounty,{6}{R},7.0,Sorcery,rare,R,R,"For each land you control, create a Treasure token. (It's an artifact with ""{T}, Sacrifice this token: Add one mana of any color."")",,,,Treasure,Foundations,2024-11-15,https://scryfall.com/card/fdn/190/brasss-bounty?utm_source=api
191,Brazen Scourge,{1}{R}{R},3.0,Creature — Gremlin,uncommon,R,R,Haste (This creature can attack and {T} as soon as it comes under your control.),3,3,,Haste,Foundations,2024-11-15,https://scryfall.com/card/fdn/191/brazen-scourge?utm_source=api
192,Burst Lightning,{R},1.0,Instant,common,R,R,"Kicker {4} (You may pay an additional {4} as you cast this spell.)
Burst Lightning deals 2 damage to any target. If this spell was kicked, it deals 4 damage instead.",,,,Kicker,Foundations,2024-11-15,https://scryfall.com/card/fdn/192/burst-lightning?utm_source=api
193,"Drakuseth, Maw of Flames",{4}{R}{R}{R},7.0,Legendary Creature — Dragon,rare,R,R,"Flying
Whenever Drakuseth attacks, it deals 4 damage to any target and 3 damage to each of up to two other targets.",7,7,,Flying,Foundations,2024-11-15,https://scryfall.com/card/fdn/193/drakuseth-maw-of-flames?utm_source=api
194,"Etali, Primal Storm",{4}{R}{R},6.0,Legendary Creature — Elder Dinosaur,rare,R,R,"Whenever Etali attacks, exile the top card of each player's library, then you may cast any number of spells from among those cards without paying their mana costs.",6,6,,,Foundations,2024-11-15,https://scryfall.com/card/fdn/194/etali-primal-storm?utm_source=api
195,Fanatical Firebrand,{R},1.0,Creature — Goblin Pirate,common,R,R,"Haste (This creature can attack and {T} as soon as it comes under your control.)
{T}, Sacrifice this creature: It deals 1 damage to any target.",1,1,,Haste,Foundations,2024-11-15,https://scryfall.com/card/fdn/195/fanatical-firebrand?utm_source=api
196,Firebrand Archer,{1}{R},2.0,Creature — Human Archer,common,R,R,"Whenever you cast a noncreature spell, this creature deals 1 damage to each opponent.",2,1,,,Foundations,2024-11-15,https://scryfall.com/card/fdn/196/firebrand-archer?utm_source=api
197,Firespitter Whelp,{2}{R},3.0,Creature — Dragon,uncommon,R,R,"Flying
Whenever you cast a noncreature or Dragon spell, this creature deals 1 damage to each opponent.",2,2,,Flying,Foundations,2024-11-15,https://scryfall.com/card/fdn/197/firespitter-whelp?utm_source=api
198,Flamewake Phoenix,{1}{R}{R},3.0,Creature — Phoenix,rare,R,R,"Flying, haste
This creature attacks each combat if able.
Ferocious — At the beginning of combat on your turn, if you control a creature with power 4 or greater, you may pay {R}. If you do, return this card from your graveyard to the battlefield.",2,2,,"Flying, Ferocious, Haste",Foundations,2024-11-15,https://scryfall.com/card/fdn/198/flamewake-phoenix?utm_source=api
199,Frenzied Goblin,{R},1.0,Creature — Goblin Berserker,uncommon,R,R,"Whenever this creature attacks, you may pay {R}. If you do, target creature can't block this turn.",1,1,,,Foundations,2024-11-15,https://scryfall.com/card/fdn/199/frenzied-goblin?utm_source=api
200,Goblin Surprise,{2}{R},3.0,Instant,common,R,R,"Choose one —
• Creatures you control get +2/+0 until end of turn.
• Create two 1/1 red Goblin creature tokens.",,,,,Foundations,2024-11-15,https://scryfall.com/card/fdn/200/goblin-surprise?utm_source=api
201,Heartfire Immolator,{1}{R},2.0,Creature — Human Wizard,uncommon,R,R,"Prowess (Whenever you cast a noncreature spell, this creature gets +1/+1 until end of turn.)
{R}, Sacrifice this creature: It deals damage equal to its power to target creature or planeswalker.",2,2,,Prowess,Foundations,2024-11-15,https://scryfall.com/card/fdn/201/heartfire-immolator?utm_source=api
202,Hidetsugu's Second Rite,{3}{R},4.0,Instant,uncommon,R,R,"If target player has exactly 10 life, Hidetsugu's Second Rite deals 10 damage to that player.",,,,,Foundations,2024-11-15,https://scryfall.com/card/fdn/202/hidetsugus-second-rite?utm_source=api
203,Involuntary Employment,{3}{R},4.0,Sorcery,common,R,R,"Gain control of target creature until end of turn. Untap that creature. It gains haste until end of turn. Create a Treasure token. (It's an artifact with ""{T}, Sacrifice this token: Add one mana of any color."")",,,,Treasure,Foundations,2024-11-15,https://scryfall.com/card/fdn/203/involuntary-employment?utm_source=api
204,"Krenko, Mob Boss",{2}{R}{R},4.0,Legendary Creature — Goblin Warrior,rare,R,R,"{T}: Create X 1/1 red Goblin creature tokens, where X is the number of Goblins you control.",3,3,,,Foundations,2024-11-15,https://scryfall.com/card/fdn/204/krenko-mob-boss?utm_source=api
205,Seismic Rupture,{2}{R},3.0,Sorcery,uncommon,R,R,Seismic Rupture deals 2 damage to each creature without flying.,,,,,Foundations,2024-11-15,https://scryfall.com/card/fdn/205/seismic-rupture?utm_source=api
206,Shivan Dragon,{4}{R}{R},6.0,Creature — Dragon,uncommon,R,R,"Flying
{R}: This creature gets +1/+0 until end of turn.",5,5,,Flying,Foundations,2024-11-15,https://scryfall.com/card/fdn/206/shivan-dragon?utm_source=api
207,Slagstorm,{1}{R}{R},3.0,Sorcery,rare,R,R,"Choose one —
• Slagstorm deals 3 damage to each creature.
• Slagstorm deals 3 damage to each player.",,,,,Foundations,2024-11-15,https://scryfall.com/card/fdn/207/slagstorm?utm_source=api
208,Spitfire Lagac,{3}{R},4.0,Creature — Lizard,common,R,R,"Landfall — Whenever a land you control enters, this creature deals 1 damage to each opponent.",3,4,,Landfall,Foundations,2024-11-15,https://scryfall.com/card/fdn/208/spitfire-lagac?utm_source=api
209,Sure Strike,{1}{R},2.0,Instant,common,R,R,Target creature gets +3/+0 and gains first strike until end of turn. (It deals combat damage before creatures without first strike.),,,,,Foundations,2024-11-15,https://scryfall.com/card/fdn/209/sure-strike?utm_source=api
210,Thrill of Possibility,{1}{R},2.0,Instant,common,R,R,"As an additional cost to cast this spell, discard a card.
Draw two cards.",,,,,Foundations,2024-11-15,https://scryfall.com/card/fdn/210/thrill-of-possibility?utm_source=api
211,Affectionate Indrik,{5}{G},6.0,Creature — Beast,uncommon,G,G,"When this creature enters, you may have it fight target creature you don't control. (Each deals damage equal to its power to the other.)",4,4,,Fight,Foundations,2024-11-15,https://scryfall.com/card/fdn/211/affectionate-indrik?utm_source=api
212,Bite Down,{1}{G},2.0,Instant,common,G,G,Target creature you control deals damage equal to its power to target creature or planeswalker you don't control.,,,,,Foundations,2024-11-15,https://scryfall.com/card/fdn/212/bite-down?utm_source=api
213,Blanchwood Armor,{2}{G},3.0,Enchantment — Aura,uncommon,G,G,"Enchant creature
Enchanted creature gets +1/+1 for each Forest you control.",,,,Enchant,Foundations,2024-11-15,https://scryfall.com/card/fdn/213/blanchwood-armor?utm_source=api
214,Broken Wings,{2}{G},3.0,Instant,common,G,G,"Destroy target artifact, enchantment, or creature with flying.",,,,,Foundations,2024-11-15,https://scryfall.com/card/fdn/214/broken-wings?utm_source=api
215,Bushwhack,{G},1.0,Sorcery,common,G,G,"Choose one —
• Search your library for a basic land card, reveal it, put it into your hand, then shuffle.
• Target creature you control fights target creature you don't control. (Each deals damage equal to its power to the other.)",,,,Fight,Foundations,2024-11-15,https://scryfall.com/card/fdn/215/bushwhack?utm_source=api
216,Doubling Season,{4}{G},5.0,Enchantment,mythic,G,G,"If an effect would create one or more tokens under your control, it creates twice that many of those tokens instead.
If an effect would put one or more counters on a permanent you control, it puts twice that many of those counters on that permanent instead.",,,,,Foundations,2024-11-15,https://scryfall.com/card/fdn/216/doubling-season?utm_source=api
217,"Dwynen, Gilt-Leaf Daen",{2}{G}{G},4.0,Legendary Creature — Elf Warrior,uncommon,G,G,"Reach (This creature can block creatures with flying.)
Other Elf creatures you control get +1/+1.
Whenever Dwynen attacks, you gain 1 life for each attacking Elf you control.",3,4,,Reach,Foundations,2024-11-15,https://scryfall.com/card/fdn/217/dwynen-gilt-leaf-daen?utm_source=api
218,Dwynen's Elite,{1}{G},2.0,Creature — Elf Warrior,common,G,G,"When this creature enters, if you control another Elf, create a 1/1 green Elf Warrior creature token.",2,2,,,Foundations,2024-11-15,https://scryfall.com/card/fdn/218/dwynens-elite?utm_source=api
219,Elvish Archdruid,{1}{G}{G},3.0,Creature — Elf Druid,rare,G,G,"Other Elf creatures you control get +1/+1.
{T}: Add {G} for each Elf you control.",2,2,,,Foundations,2024-11-15,https://scryfall.com/card/fdn/219/elvish-archdruid?utm_source=api
220,Garruk's Uprising,{2}{G},3.0,Enchantment,uncommon,G,G,"When this enchantment enters, if you control a creature with power 4 or greater, draw a card.
Creatures you control have trample. (Each of those creatures can deal excess combat damage to the player or planeswalker it's attacking.)
Whenever a creature you control with power 4 or greater enters, draw a card.",,,,,Foundations,2024-11-15,https://scryfall.com/card/fdn/220/garruks-uprising?utm_source=api
221,Genesis Wave,{X}{G}{G}{G},3.0,Sorcery,rare,G,G,Reveal the top X cards of your library. You may put any number of permanent cards with mana value X or less from among them onto the battlefield. Then put all cards revealed this way that weren't put onto the battlefield into your graveyard.,,,,,Foundations,2024-11-15,https://scryfall.com/card/fdn/221/genesis-wave?utm_source=api
222,"Ghalta, Primal Hunger",{10}{G}{G},12.0,Legendary Creature — Elder Dinosaur,rare,G,G,"This spell costs {X} less to cast, where X is the total power of creatures you control.
Trample (This creature can deal excess combat damage to the player or planeswalker it's attacking.)",12,12,,Trample,Foundations,2024-11-15,https://scryfall.com/card/fdn/222/ghalta-primal-hunger?utm_source=api
223,Giant Growth,{G},1.0,Instant,common,G,G,Target creature gets +3/+3 until end of turn.,,,,,Foundations,2024-11-15,https://scryfall.com/card/fdn/223/giant-growth?utm_source=api
224,Gnarlid Colony,{1}{G},2.0,Creature — Beast,common,G,G,"Kicker {2}{G} (You may pay an additional {2}{G} as you cast this spell.)
If this creature was kicked, it enters with two +1/+1 counters on it.
Each creature you control with a +1/+1 counter on it has trample. (It can deal excess combat damage to the player or planeswalker it's attacking.)",2,2,,Kicker,Foundations,2024-11-15,https://scryfall.com/card/fdn/224/gnarlid-colony?utm_source=api
225,Grow from the Ashes,{2}{G},3.0,Sorcery,common,G,G,"Kicker {2} (You may pay an additional {2} as you cast this spell.)
Search your library for a basic land card, put it onto the battlefield, then shuffle. If this spell was kicked, instead search your library for two basic land cards, put them onto the battlefield, then shuffle.",,,,Kicker,Foundations,2024-11-15,https://scryfall.com/card/fdn/225/grow-from-the-ashes?utm_source=api
226,Inspiring Call,{2}{G},3.0,Instant,uncommon,G,G,"Draw a card for each creature you control with a +1/+1 counter on it. Those creatures gain indestructible until end of turn. (Damage and effects that say ""destroy"" don't destroy them.)",,,,,Foundations,2024-11-15,https://scryfall.com/card/fdn/226/inspiring-call?utm_source=api
227,Llanowar Elves,{G},1.0,Creature — Elf Druid,common,G,G,{T}: Add {G}.,1,1,,,Foundations,2024-11-15,https://scryfall.com/card/fdn/227/llanowar-elves?utm_source=api
228,Mild-Mannered Librarian,{G},1.0,Creature — Human,uncommon,G,G,{3}{G}: This creature becomes a Werewolf. Put two +1/+1 counters on it and you draw a card. Activate only once.,1,1,,,Foundations,2024-11-15,https://scryfall.com/card/fdn/228/mild-mannered-librarian?utm_source=api
229,Nessian Hornbeetle,{1}{G},2.0,Creature — Insect,uncommon,G,G,"At the beginning of combat on your turn, if you control another creature with power 4 or greater, put a +1/+1 counter on this creature.",2,2,,,Foundations,2024-11-15,https://scryfall.com/card/fdn/229/nessian-hornbeetle?utm_source=api
230,Overrun,{2}{G}{G}{G},5.0,Sorcery,uncommon,G,G,Creatures you control get +3/+3 and gain trample until end of turn. (Each of those creatures can deal excess combat damage to the player or planeswalker it's attacking.),,,,,Foundations,2024-11-15,https://scryfall.com/card/fdn/230/overrun?utm_source=api
231,Reclamation Sage,{2}{G},3.0,Creature — Elf Shaman,uncommon,G,G,"When this creature enters, you may destroy target artifact or enchantment.",2,1,,,Foundations,2024-11-15,https://scryfall.com/card/fdn/231/reclamation-sage?utm_source=api
232,Scavenging Ooze,{1}{G},2.0,Creature — Ooze,rare,G,G,"{G}: Exile target card from a graveyard. If it was a creature card, put a +1/+1 counter on this creature and you gain 1 life.",2,2,,,Foundations,2024-11-15,https://scryfall.com/card/fdn/232/scavenging-ooze?utm_source=api
233,Snakeskin Veil,{G},1.0,Instant,uncommon,G,G,Put a +1/+1 counter on target creature you control. It gains hexproof until end of turn. (It can't be the target of spells or abilities your opponents control.),,,,,Foundations,2024-11-15,https://scryfall.com/card/fdn/233/snakeskin-veil?utm_source=api
234,Vivien Reid,{3}{G}{G},5.0,Legendary Planeswalker — Vivien,mythic,G,G,"+1: Look at the top four cards of your library. You may reveal a creature or land card from among them and put it into your hand. Put the rest on the bottom of your library in a random order.
−3: Destroy target artifact, enchantment, or creature with flying.
−8: You get an emblem with ""Creatures you control get +2/+2 and have vigilance, trample, and indestructible.""",,,5,,Foundations,2024-11-15,https://scryfall.com/card/fdn/234/vivien-reid?utm_source=api
235,Wary Thespian,{1}{G},2.0,Creature — Cat Druid,common,G,G,"When this creature enters or dies, surveil 1. (Look at the top card of your library. You may put it into your graveyard.)",3,1,,Surveil,Foundations,2024-11-15,https://scryfall.com/card/fdn/235/wary-thespian?utm_source=api
236,Wildwood Scourge,{X}{G},1.0,Creature — Hydra,uncommon,G,G,"This creature enters with X +1/+1 counters on it.
Whenever one or more +1/+1 counters are put on another non-Hydra creature you control, put a +1/+1 counter on this creature.",0,0,,,Foundations,2024-11-15,https://scryfall.com/card/fdn/236/wildwood-scourge?utm_source=api
237,"Balmor, Battlemage Captain",{U}{R},2.0,Legendary Creature — Bird Wizard,uncommon,"R, U","R, U","Flying
Whenever you cast an instant or sorcery spell, creatures you control get +1/+0 and gain trample until end of turn.",1,3,,Flying,Foundations,2024-11-15,https://scryfall.com/card/fdn/237/balmor-battlemage-captain?utm_source=api
238,Consuming Aberration,{3}{U}{B},5.0,Creature — Horror,rare,"B, U","B, U","Consuming Aberration's power and toughness are each equal to the number of cards in your opponents' graveyards.
Whenever you cast a spell, each opponent reveals cards from the top of their library until they reveal a land card, then puts those cards into their graveyard.",*,*,,,Foundations,2024-11-15,https://scryfall.com/card/fdn/238/consuming-aberration?utm_source=api
239,Empyrean Eagle,{1}{W}{U},3.0,Creature — Bird Spirit,uncommon,"U, W","U, W","Flying
Other creatures you control with flying get +1/+1.",2,3,,Flying,Foundations,2024-11-15,https://scryfall.com/card/fdn/239/empyrean-eagle?utm_source=api
240,Good-Fortune Unicorn,{1}{G}{W},3.0,Creature — Unicorn,uncommon,"G, W","G, W","Whenever another creature you control enters, put a +1/+1 counter on that creature.",2,2,,,Foundations,2024-11-15,https://scryfall.com/card/fdn/240/good-fortune-unicorn?utm_source=api
241,Heroic Reinforcements,{2}{R}{W},4.0,Sorcery,uncommon,"R, W","R, W","Create two 1/1 white Soldier creature tokens. Until end of turn, creatures you control get +1/+1 and gain haste. (They can attack and {T} this turn.)",,,,,Foundations,2024-11-15,https://scryfall.com/card/fdn/241/heroic-reinforcements?utm_source=api
242,"Lathril, Blade of the Elves",{2}{B}{G},4.0,Legendary Creature — Elf Noble,rare,"B, G","B, G","Menace (This creature can't be blocked except by two or more creatures.)
Whenever Lathril deals combat damage to a player, create that many 1/1 green Elf Warrior creature tokens.
{T}, Tap ten untapped Elves you control: Each opponent loses 10 life and you gain 10 life.",2,3,,Menace,Foundations,2024-11-15,https://scryfall.com/card/fdn/242/lathril-blade-of-the-elves?utm_source=api
