collector_number,name,mana_cost,cmc,type_line,rarity,colors,color_identity,oracle_text,power,toughness,loyalty,keywords,set_name,released_at,scryfall_uri
243,"Muldrotha, the Gravetide",{3}{B}{G}{U},6.0,Legendary Creature — Elemental Avatar,mythic,"B, G, U","B, G, U","During each of your turns, you may play a land and cast a permanent spell of each permanent type from your graveyard. (If a card has multiple permanent types, choose one as you play it.)",6,6,,,Foundations,2024-11-15,https://scryfall.com/card/fdn/243/muldrotha-the-gravetide?utm_source=api
244,Progenitus,{W}{W}{U}{U}{B}{B}{R}{R}{G}{G},10.0,Legendary Creature — Hydra Avatar,mythic,"B, G, R, U, W","B, G, R, U, W","Protection from everything
If Progenitus would be put into a graveyard from anywhere, reveal Progenitus and shuffle it into its owner's library instead.",10,10,,Protection,Foundations,2024-11-15,https://scryfall.com/card/fdn/244/progenitus?utm_source=api
245,"Ruby, Daring Tracker",{R}{G},2.0,Legendary Creature — Human Scout,uncommon,"G, R","G, R","Haste (This creature can attack and {T} as soon as it comes under your control.)
Whenever Ruby attacks while you control a creature with power 4 or greater, Ruby gets +2/+2 until end of turn.
{T}: Add {R} or {G}.",1,2,,Haste,Foundations,2024-11-15,https://scryfall.com/card/fdn/245/ruby-daring-tracker?utm_source=api
246,Swiftblade Vindicator,{R}{W},2.0,Creature — Human Soldier,rare,"R, W","R, W","Double strike (This creature deals both first-strike and regular combat damage.)
Vigilance (Attacking doesn't cause this creature to tap.)
Trample (This creature can deal excess combat damage to the player or planeswalker it's attacking.)",1,1,,"Vigilance, Trample, Double strike",Foundations,2024-11-15,https://scryfall.com/card/fdn/246/swiftblade-vindicator?utm_source=api
247,"Tatyova, Benthic Druid",{3}{G}{U},5.0,Legendary Creature — Merfolk Druid,uncommon,"G, U","G, U","Landfall — Whenever a land you control enters, you gain 1 life and draw a card.",3,3,,Landfall,Foundations,2024-11-15,https://scryfall.com/card/fdn/247/tatyova-benthic-druid?utm_source=api
248,Thousand-Year Storm,{4}{U}{R},6.0,Enchantment,rare,"R, U","R, U","Whenever you cast an instant or sorcery spell, copy it for each other instant and sorcery spell you've cast before it this turn. You may choose new targets for the copies.",,,,,Foundations,2024-11-15,https://scryfall.com/card/fdn/248/thousand-year-storm?utm_source=api
249,Adventuring Gear,{1},1.0,Artifact — Equipment,uncommon,,,"Landfall — Whenever a land you control enters, equipped creature gets +2/+2 until end of turn.
Equip {1} ({1}: Attach to target creature you control. Equip only as a sorcery.)",,,,"Equip, Landfall",Foundations,2024-11-15,https://scryfall.com/card/fdn/249/adventuring-gear?utm_source=api
250,Burnished Hart,{3},3.0,Artifact Creature — Elk,uncommon,,,"{3}, Sacrifice this creature: Search your library for up to two basic land cards, put them onto the battlefield tapped, then shuffle.",2,2,,,Foundations,2024-11-15,https://scryfall.com/card/fdn/250/burnished-hart?utm_source=api
251,Campus Guide,{2},2.0,Artifact Creature — Golem,common,,,"When this creature enters, you may search your library for a basic land card, reveal it, then shuffle and put that card on top.",2,1,,,Foundations,2024-11-15,https://scryfall.com/card/fdn/251/campus-guide?utm_source=api
252,Gleaming Barrier,{2},2.0,Artifact Creature — Wall,common,,,"Defender
When this creature dies, create a Treasure token. (It's an artifact with ""{T}, Sacrifice this token: Add one mana of any color."")",0,4,,"Treasure, Defender",Foundations,2024-11-15,https://scryfall.com/card/fdn/252/gleaming-barrier?utm_source=api
253,Goldvein Pick,{2},2.0,Artifact — Equipment,common,,,"Equipped creature gets +1/+1.
Whenever equipped creature deals combat damage to a player, create a Treasure token. (It's an artifact with ""{T}, Sacrifice this token: Add one mana of any color."")
Equip {1} ({1}: Attach to target creature you control. Equip only as a sorcery.)",,,,"Treasure, Equip",Foundations,2024-11-15,https://scryfall.com/card/fdn/253/goldvein-pick?utm_source=api
254,Heraldic Banner,{3},3.0,Artifact,uncommon,,,"As this artifact enters, choose a color.
Creatures you control of the chosen color get +1/+0.
{T}: Add one mana of the chosen color.",,,,,Foundations,2024-11-15,https://scryfall.com/card/fdn/254/heraldic-banner?utm_source=api
255,Juggernaut,{4},4.0,Artifact Creature — Juggernaut,uncommon,,,"This creature attacks each combat if able.
This creature can't be blocked by Walls.",5,3,,,Foundations,2024-11-15,https://scryfall.com/card/fdn/255/juggernaut?utm_source=api
256,Meteor Golem,{7},7.0,Artifact Creature — Golem,uncommon,,,"When this creature enters, destroy target nonland permanent an opponent controls.",3,3,,,Foundations,2024-11-15,https://scryfall.com/card/fdn/256/meteor-golem?utm_source=api
257,Solemn Simulacrum,{4},4.0,Artifact Creature — Golem,rare,,,"When this creature enters, you may search your library for a basic land card, put that card onto the battlefield tapped, then shuffle.
When this creature dies, you may draw a card.",2,2,,,Foundations,2024-11-15,https://scryfall.com/card/fdn/257/solemn-simulacrum?utm_source=api
258,Swiftfoot Boots,{2},2.0,Artifact — Equipment,uncommon,,,"Equipped creature has hexproof and haste. (It can't be the target of spells or abilities your opponents control. It can attack and {T} no matter when it came under your control.)
Equip {1} ({1}: Attach to target creature you control. Equip only as a sorcery.)",,,,Equip,Foundations,2024-11-15,https://scryfall.com/card/fdn/258/swiftfoot-boots?utm_source=api
259,Bloodfell Caves,,0.0,Land,common,,"B, R","This land enters tapped.
When this land enters, you gain 1 life.
{T}: Add {B} or {R}.",,,,,Foundations,2024-11-15,https://scryfall.com/card/fdn/259/bloodfell-caves?utm_source=api
260,Blossoming Sands,,0.0,Land,common,,"G, W","This land enters tapped.
When this land enters, you gain 1 life.
{T}: Add {G} or {W}.",,,,,Foundations,2024-11-15,https://scryfall.com/card/fdn/260/blossoming-sands?utm_source=api
261,Dismal Backwater,,0.0,Land,common,,"B, U","This land enters tapped.
When this land enters, you gain 1 life.
{T}: Add {U} or {B}.",,,,,Foundations,2024-11-15,https://scryfall.com/card/fdn/261/dismal-backwater?utm_source=api
262,Evolving Wilds,,0.0,Land,common,,,"{T}, Sacrifice this land: Search your library for a basic land card, put it onto the battlefield tapped, then shuffle.",,,,,Foundations,2024-11-15,https://scryfall.com/card/fdn/262/evolving-wilds?utm_source=api
263,Jungle Hollow,,0.0,Land,common,,"B, G","This land enters tapped.
When this land enters, you gain 1 life.
{T}: Add {B} or {G}.",,,,,Foundations,2024-11-15,https://scryfall.com/card/fdn/263/jungle-hollow?utm_source=api
264,Rogue's Passage,,0.0,Land,uncommon,,,"{T}: Add {C}.
{4}, {T}: Target creature can't be blocked this turn.",,,,,Foundations,2024-11-15,https://scryfall.com/card/fdn/264/rogues-passage?utm_source=api
265,Rugged Highlands,,0.0,Land,common,,"G, R","This land enters tapped.
When this land enters, you gain 1 life.
{T}: Add {R} or {G}.",,,,,Foundations,2024-11-15,https://scryfall.com/card/fdn/265/rugged-highlands?utm_source=api
266,Scoured Barrens,,0.0,Land,common,,"B, W","This land enters tapped.
When this land enters, you gain 1 life.
{T}: Add {W} or {B}.",,,,,Foundations,2024-11-15,https://scryfall.com/card/fdn/266/scoured-barrens?utm_source=api
267,Secluded Courtyard,,0.0,Land,uncommon,,,"As this land enters, choose a creature type.
{T}: Add {C}.
{T}: Add one mana of any color. Spend this mana only to cast a creature spell of the chosen type or activate an ability of a creature source of the chosen type.",,,,,Foundations,2024-11-15,https://scryfall.com/card/fdn/267/secluded-courtyard?utm_source=api
268,Swiftwater Cliffs,,0.0,Land,common,,"R, U","This land enters tapped.
When this land enters, you gain 1 life.
{T}: Add {U} or {R}.",,,,,Foundations,2024-11-15,https://scryfall.com/card/fdn/268/swiftwater-cliffs?utm_source=api
269,Thornwood Falls,,0.0,Land,common,,"G, U","This land enters tapped.
When this land enters, you gain 1 life.
{T}: Add {G} or {U}.",,,,,Foundations,2024-11-15,https://scryfall.com/card/fdn/269/thornwood-falls?utm_source=api
270,Tranquil Cove,,0.0,Land,common,,"U, W","This land enters tapped.
When this land enters, you gain 1 life.
{T}: Add {W} or {U}.",,,,,Foundations,2024-11-15,https://scryfall.com/card/fdn/270/tranquil-cove?utm_source=api
271,Wind-Scarred Crag,,0.0,Land,common,,"R, W","This land enters tapped.
When this land enters, you gain 1 life.
{T}: Add {R} or {W}.",,,,,Foundations,2024-11-15,https://scryfall.com/card/fdn/271/wind-scarred-crag?utm_source=api
272,Plains,,0.0,Basic Land — Plains,common,,W,({T}: Add {W}.),,,,,Foundations,2024-11-15,https://scryfall.com/card/fdn/272/plains?utm_source=api
274,Island,,0.0,Basic Land — Island,common,,U,({T}: Add {U}.),,,,,Foundations,2024-11-15,https://scryfall.com/card/fdn/274/island?utm_source=api
276,Swamp,,0.0,Basic Land — Swamp,common,,B,({T}: Add {B}.),,,,,Foundations,2024-11-15,https://scryfall.com/card/fdn/276/swamp?utm_source=api
278,Mountain,,0.0,Basic Land — Mountain,common,,R,({T}: Add {R}.),,,,,Foundations,2024-11-15,https://scryfall.com/card/fdn/278/mountain?utm_source=api
280,Forest,,0.0,Basic Land — Forest,common,,G,({T}: Add {G}.),,,,,Foundations,2024-11-15,https://scryfall.com/card/fdn/280/forest?utm_source=api
488,Adamant Will,{1}{W},2.0,Instant,common,W,W,"Target creature gets +2/+2 and gains indestructible until end of turn. (Damage and effects that say ""destroy"" don't destroy it.)",,,,,Foundations,2024-11-15,https://scryfall.com/card/fdn/488/adamant-will?utm_source=api
489,Ancestor Dragon,{4}{W}{W},6.0,Creature — Dragon,rare,W,W,"Flying
Whenever one or more creatures you control attack, you gain 1 life for each attacking creature.",5,6,,Flying,Foundations,2024-11-15,https://scryfall.com/card/fdn/489/ancestor-dragon?utm_source=api
490,Angelic Edict,{4}{W},5.0,Sorcery,common,W,W,Exile target creature or enchantment.,,,,,Foundations,2024-11-15,https://scryfall.com/card/fdn/490/angelic-edict?utm_source=api
491,Bishop's Soldier,{1}{W},2.0,Creature — Vampire Soldier,common,W,W,Lifelink (Damage dealt by this creature also causes you to gain that much life.),2,2,,Lifelink,Foundations,2024-11-15,https://scryfall.com/card/fdn/491/bishops-soldier?utm_source=api
492,Deadly Riposte,{1}{W},2.0,Instant,common,W,W,Deadly Riposte deals 3 damage to target tapped creature and you gain 2 life.,,,,,Foundations,2024-11-15,https://scryfall.com/card/fdn/492/deadly-riposte?utm_source=api
493,Elspeth's Smite,{W},1.0,Instant,uncommon,W,W,"Elspeth's Smite deals 3 damage to target attacking or blocking creature. If that creature would die this turn, exile it instead.",,,,,Foundations,2024-11-15,https://scryfall.com/card/fdn/493/elspeths-smite?utm_source=api
494,Herald of Faith,{3}{W}{W},5.0,Creature — Angel,uncommon,W,W,"Flying
Whenever this creature attacks, you gain 2 life.",4,3,,Flying,Foundations,2024-11-15,https://scryfall.com/card/fdn/494/herald-of-faith?utm_source=api
495,Ingenious Leonin,{4}{W},5.0,Creature — Cat Soldier,uncommon,W,W,"{3}{W}: Put a +1/+1 counter on another target attacking creature you control. If that creature is a Cat, it gains first strike until end of turn. (It deals combat damage before creatures without first strike.)",4,4,,,Foundations,2024-11-15,https://scryfall.com/card/fdn/495/ingenious-leonin?utm_source=api
496,Inspiring Overseer,{2}{W},3.0,Creature — Angel Cleric,common,W,W,"Flying
When this creature enters, you gain 1 life and draw a card.",2,1,,Flying,Foundations,2024-11-15,https://scryfall.com/card/fdn/496/inspiring-overseer?utm_source=api
497,Jazal Goldmane,{2}{W}{W},4.0,Legendary Creature — Cat Warrior,rare,W,W,"First strike (This creature deals combat damage before creatures without first strike.)
{3}{W}{W}: Attacking creatures you control get +X/+X until end of turn, where X is the number of attacking creatures.",4,4,,First strike,Foundations,2024-11-15,https://scryfall.com/card/fdn/497/jazal-goldmane?utm_source=api
498,Leonin Skyhunter,{W}{W},2.0,Creature — Cat Knight,uncommon,W,W,Flying,2,2,,Flying,Foundations,2024-11-15,https://scryfall.com/card/fdn/498/leonin-skyhunter?utm_source=api
499,Leonin Vanguard,{W},1.0,Creature — Cat Soldier,uncommon,W,W,"At the beginning of combat on your turn, if you control three or more creatures, this creature gets +1/+1 until end of turn and you gain 1 life.",1,1,,,Foundations,2024-11-15,https://scryfall.com/card/fdn/499/leonin-vanguard?utm_source=api
500,Moment of Triumph,{W},1.0,Instant,common,W,W,Target creature gets +2/+2 until end of turn. You gain 2 life.,,,,,Foundations,2024-11-15,https://scryfall.com/card/fdn/500/moment-of-triumph?utm_source=api
501,Pacifism,{1}{W},2.0,Enchantment — Aura,common,W,W,"Enchant creature
Enchanted creature can't attack or block.",,,,Enchant,Foundations,2024-11-15,https://scryfall.com/card/fdn/501/pacifism?utm_source=api
502,Prayer of Binding,{3}{W},4.0,Enchantment,uncommon,W,W,"Flash
When this enchantment enters, exile up to one target nonland permanent an opponent controls until this enchantment leaves the battlefield. You gain 2 life.",,,,Flash,Foundations,2024-11-15,https://scryfall.com/card/fdn/502/prayer-of-binding?utm_source=api
503,Twinblade Paladin,{3}{W},4.0,Creature — Human Knight,uncommon,W,W,"Whenever you gain life, put a +1/+1 counter on this creature.
As long as you have 25 or more life, this creature has double strike. (It deals both first-strike and regular combat damage.)",3,3,,,Foundations,2024-11-15,https://scryfall.com/card/fdn/503/twinblade-paladin?utm_source=api
504,Burrog Befuddler,{1}{U},2.0,Creature — Frog Wizard,common,U,U,"Flash (You may cast this spell any time you could cast an instant.)
When this creature enters, target creature an opponent controls gets -1/-0 until end of turn.",2,1,,Flash,Foundations,2024-11-15,https://scryfall.com/card/fdn/504/burrog-befuddler?utm_source=api
505,Cancel,{1}{U}{U},3.0,Instant,common,U,U,Counter target spell.,,,,,Foundations,2024-11-15,https://scryfall.com/card/fdn/505/cancel?utm_source=api
506,Corsair Captain,{2}{U},3.0,Creature — Human Pirate,rare,U,U,"When this creature enters, create a Treasure token. (It's an artifact with ""{T}, Sacrifice this token: Add one mana of any color."")
Other Pirates you control get +1/+1.",2,2,,Treasure,Foundations,2024-11-15,https://scryfall.com/card/fdn/506/corsair-captain?utm_source=api
507,Eaten by Piranhas,{1}{U},2.0,Enchantment — Aura,uncommon,U,U,"Flash (You may cast this spell any time you could cast an instant.)
Enchant creature
Enchanted creature loses all abilities and is a black Skeleton creature with base power and toughness 1/1. (It loses all other colors, card types, and creature types.)",,,,"Enchant, Flash",Foundations,2024-11-15,https://scryfall.com/card/fdn/507/eaten-by-piranhas?utm_source=api
508,Exclusion Mage,{2}{U},3.0,Creature — Human Wizard,uncommon,U,U,"When this creature enters, return target creature an opponent controls to its owner's hand.",2,2,,,Foundations,2024-11-15,https://scryfall.com/card/fdn/508/exclusion-mage?utm_source=api
509,Into the Roil,{1}{U},2.0,Instant,common,U,U,"Kicker {1}{U} (You may pay an additional {1}{U} as you cast this spell.)
Return target nonland permanent to its owner's hand. If this spell was kicked, draw a card.",,,,Kicker,Foundations,2024-11-15,https://scryfall.com/card/fdn/509/into-the-roil?utm_source=api
510,Kitesail Corsair,{1}{U},2.0,Creature — Human Pirate,common,U,U,This creature has flying as long as it's attacking.,2,1,,,Foundations,2024-11-15,https://scryfall.com/card/fdn/510/kitesail-corsair?utm_source=api
511,Mystic Archaeologist,{1}{U},2.0,Creature — Human Wizard,rare,U,U,{3}{U}{U}: Draw two cards.,2,1,,,Foundations,2024-11-15,https://scryfall.com/card/fdn/511/mystic-archaeologist?utm_source=api
512,Opt,{U},1.0,Instant,common,U,U,"Scry 1. (Look at the top card of your library. You may put that card on the bottom.)
Draw a card.",,,,Scry,Foundations,2024-11-15,https://scryfall.com/card/fdn/512/opt?utm_source=api
513,Quick Study,{2}{U},3.0,Instant,common,U,U,Draw two cards.,,,,,Foundations,2024-11-15,https://scryfall.com/card/fdn/513/quick-study?utm_source=api
514,Starlight Snare,{2}{U},3.0,Enchantment — Aura,common,U,U,"Enchant creature
When this Aura enters, tap enchanted creature.
Enchanted creature doesn't untap during its controller's untap step.",,,,Enchant,Foundations,2024-11-15,https://scryfall.com/card/fdn/514/starlight-snare?utm_source=api
515,Storm Fleet Spy,{2}{U},3.0,Creature — Human Pirate,uncommon,U,U,"Raid — When this creature enters, if you attacked this turn, draw a card.",2,2,,Raid,Foundations,2024-11-15,https://scryfall.com/card/fdn/515/storm-fleet-spy?utm_source=api
516,Bloodtithe Collector,{4}{B},5.0,Creature — Vampire Noble,uncommon,B,B,"Flying
When this creature enters, if an opponent lost life this turn, each opponent discards a card.",3,4,,Flying,Foundations,2024-11-15,https://scryfall.com/card/fdn/516/bloodtithe-collector?utm_source=api
517,Cemetery Recruitment,{1}{B},2.0,Sorcery,common,B,B,"Return target creature card from your graveyard to your hand. If it's a Zombie card, draw a card.",,,,,Foundations,2024-11-15,https://scryfall.com/card/fdn/517/cemetery-recruitment?utm_source=api
518,Crossway Troublemakers,{5}{B},6.0,Creature — Vampire,rare,B,B,"Attacking Vampires you control have deathtouch and lifelink. (Any amount of damage they deal to a creature is enough to destroy it. Damage dealt by those creatures also causes their controller to gain that much life.)
Whenever a Vampire you control dies, you may pay 2 life. If you do, draw a card.",5,5,,,Foundations,2024-11-15,https://scryfall.com/card/fdn/518/crossway-troublemakers?utm_source=api
519,Crow of Dark Tidings,{2}{B},3.0,Creature — Zombie Bird,common,B,B,"Flying
When this creature enters or dies, mill two cards. (Put the top two cards of your library into your graveyard.)",2,1,,"Flying, Mill",Foundations,2024-11-15,https://scryfall.com/card/fdn/519/crow-of-dark-tidings?utm_source=api
520,Deadly Plot,{3}{B},4.0,Instant,uncommon,B,B,"Choose one —
• Destroy target creature or planeswalker.
• Return target Zombie creature card from your graveyard to the battlefield tapped.",,,,,Foundations,2024-11-15,https://scryfall.com/card/fdn/520/deadly-plot?utm_source=api
521,Death Baron,{1}{B}{B},3.0,Creature — Zombie Wizard,rare,B,B,Skeletons you control and other Zombies you control get +1/+1 and have deathtouch. (Any amount of damage they deal to a creature is enough to destroy it.),2,2,,,Foundations,2024-11-15,https://scryfall.com/card/fdn/521/death-baron?utm_source=api
522,Highborn Vampire,{3}{B},4.0,Creature — Vampire Warrior,common,B,B,,4,3,,,Foundations,2024-11-15,https://scryfall.com/card/fdn/522/highborn-vampire?utm_source=api
523,Maalfeld Twins,{5}{B},6.0,Creature — Zombie,uncommon,B,B,"When this creature dies, create two 2/2 black Zombie creature tokens.",4,4,,,Foundations,2024-11-15,https://scryfall.com/card/fdn/523/maalfeld-twins?utm_source=api
524,Moment of Craving,{1}{B},2.0,Instant,common,B,B,Target creature gets -2/-2 until end of turn. You gain 2 life.,,,,,Foundations,2024-11-15,https://scryfall.com/card/fdn/524/moment-of-craving?utm_source=api
525,Offer Immortality,{1}{B},2.0,Instant,common,B,B,"Target creature gains deathtouch and indestructible until end of turn. (Damage and effects that say ""destroy"" don't destroy it.)",,,,,Foundations,2024-11-15,https://scryfall.com/card/fdn/525/offer-immortality?utm_source=api
526,Skeleton Archer,{3}{B},4.0,Creature — Skeleton Archer,common,B,B,"When this creature enters, it deals 1 damage to any target.",3,3,,,Foundations,2024-11-15,https://scryfall.com/card/fdn/526/skeleton-archer?utm_source=api
527,Suspicious Shambler,{3}{B},4.0,Creature — Zombie,common,B,B,"{4}{B}{B}, Exile this card from your graveyard: Create two 2/2 black Zombie creature tokens. Activate only as a sorcery.",4,2,,,Foundations,2024-11-15,https://scryfall.com/card/fdn/527/suspicious-shambler?utm_source=api
528,Undying Malice,{B},1.0,Instant,common,B,B,"Until end of turn, target creature gains ""When this creature dies, return it to the battlefield tapped under its owner's control with a +1/+1 counter on it.""",,,,,Foundations,2024-11-15,https://scryfall.com/card/fdn/528/undying-malice?utm_source=api
529,Untamed Hunger,{2}{B},3.0,Enchantment — Aura,common,B,B,"Enchant creature
Enchanted creature gets +2/+1 and has menace. (It can't be blocked except by two or more creatures.)",,,,Enchant,Foundations,2024-11-15,https://scryfall.com/card/fdn/529/untamed-hunger?utm_source=api
530,Vampire Interloper,{1}{B},2.0,Creature — Vampire Scout,common,B,B,"Flying
This creature can't block.",2,1,,Flying,Foundations,2024-11-15,https://scryfall.com/card/fdn/530/vampire-interloper?utm_source=api
531,Vampire Neonate,{B},1.0,Creature — Vampire,common,B,B,"{2}, {T}: Each opponent loses 1 life and you gain 1 life.",0,3,,,Foundations,2024-11-15,https://scryfall.com/card/fdn/531/vampire-neonate?utm_source=api
532,Vampire Spawn,{2}{B},3.0,Creature — Vampire,common,B,B,"When this creature enters, each opponent loses 2 life and you gain 2 life.",2,3,,,Foundations,2024-11-15,https://scryfall.com/card/fdn/532/vampire-spawn?utm_source=api
533,Battle-Rattle Shaman,{3}{R},4.0,Creature — Goblin Shaman,uncommon,R,R,"At the beginning of combat on your turn, you may have target creature get +2/+0 until end of turn.",2,2,,,Foundations,2024-11-15,https://scryfall.com/card/fdn/533/battle-rattle-shaman?utm_source=api
534,Carnelian Orb of Dragonkind,{2}{R},3.0,Artifact,common,R,R,"{T}: Add {R}. If that mana is spent on a Dragon creature spell, it gains haste until end of turn.",,,,,Foundations,2024-11-15,https://scryfall.com/card/fdn/534/carnelian-orb-of-dragonkind?utm_source=api
535,Dragon Fodder,{1}{R},2.0,Sorcery,common,R,R,Create two 1/1 red Goblin creature tokens.,,,,,Foundations,2024-11-15,https://scryfall.com/card/fdn/535/dragon-fodder?utm_source=api
536,Dragonlord's Servant,{1}{R},2.0,Creature — Goblin Shaman,uncommon,R,R,Dragon spells you cast cost {1} less to cast.,1,3,,,Foundations,2024-11-15,https://scryfall.com/card/fdn/536/dragonlords-servant?utm_source=api
537,Dropkick Bomber,{2}{R},3.0,Creature — Goblin Warrior,rare,R,R,"Other Goblins you control get +1/+1.
{R}: Until end of turn, another target Goblin you control gains flying and ""When this creature deals combat damage, sacrifice it.""",2,3,,,Foundations,2024-11-15,https://scryfall.com/card/fdn/537/dropkick-bomber?utm_source=api
538,Fire Elemental,{3}{R}{R},5.0,Creature — Elemental,common,R,R,,5,4,,,Foundations,2024-11-15,https://scryfall.com/card/fdn/538/fire-elemental?utm_source=api
539,Goblin Oriflamme,{1}{R},2.0,Enchantment,uncommon,R,R,Attacking creatures you control get +1/+0.,,,,,Foundations,2024-11-15,https://scryfall.com/card/fdn/539/goblin-oriflamme?utm_source=api
540,Goblin Smuggler,{2}{R},3.0,Creature — Goblin Rogue,common,R,R,"Haste (This creature can attack and {T} as soon as it comes under your control.)
{T}: Another target creature with power 2 or less can't be blocked this turn.",2,2,,Haste,Foundations,2024-11-15,https://scryfall.com/card/fdn/540/goblin-smuggler?utm_source=api
541,Kargan Dragonrider,{1}{R},2.0,Creature — Human Warrior,common,R,R,"As long as you control a Dragon, this creature has flying.",2,2,,,Foundations,2024-11-15,https://scryfall.com/card/fdn/541/kargan-dragonrider?utm_source=api
542,Kindled Fury,{R},1.0,Instant,common,R,R,Target creature gets +1/+0 and gains first strike until end of turn. (It deals combat damage before creatures without first strike.),,,,,Foundations,2024-11-15,https://scryfall.com/card/fdn/542/kindled-fury?utm_source=api
543,Raging Redcap,{2}{R},3.0,Creature — Goblin Knight,common,R,R,Double strike (This creature deals both first-strike and regular combat damage.),1,2,,Double strike,Foundations,2024-11-15,https://scryfall.com/card/fdn/543/raging-redcap?utm_source=api
544,Rapacious Dragon,{4}{R},5.0,Creature — Dragon,common,R,R,"Flying
When this creature enters, create two Treasure tokens. (They're artifacts with ""{T}, Sacrifice this token: Add one mana of any color."")",3,3,,"Flying, Treasure",Foundations,2024-11-15,https://scryfall.com/card/fdn/544/rapacious-dragon?utm_source=api
545,Scorching Dragonfire,{1}{R},2.0,Instant,common,R,R,"Scorching Dragonfire deals 3 damage to target creature or planeswalker. If that creature or planeswalker would die this turn, exile it instead.",,,,,Foundations,2024-11-15,https://scryfall.com/card/fdn/545/scorching-dragonfire?utm_source=api
546,Seize the Spoils,{2}{R},3.0,Sorcery,common,R,R,"As an additional cost to cast this spell, discard a card.
Draw two cards and create a Treasure token. (It's an artifact with ""{T}, Sacrifice this token: Add one mana of any color."")",,,,Treasure,Foundations,2024-11-15,https://scryfall.com/card/fdn/546/seize-the-spoils?utm_source=api
547,Skyraker Giant,{2}{R}{R},4.0,Creature — Giant,common,R,R,Reach (This creature can block creatures with flying.),4,3,,Reach,Foundations,2024-11-15,https://scryfall.com/card/fdn/547/skyraker-giant?utm_source=api
548,Swab Goblin,{1}{R},2.0,Creature — Goblin Pirate,common,R,R,,2,2,,,Foundations,2024-11-15,https://scryfall.com/card/fdn/548/swab-goblin?utm_source=api
549,Terror of Mount Velus,{5}{R}{R},7.0,Creature — Dragon,rare,R,R,"Flying
Double strike (This creature deals both first-strike and regular combat damage.)
When this creature enters, creatures you control gain double strike until end of turn.",5,5,,"Flying, Double strike",Foundations,2024-11-15,https://scryfall.com/card/fdn/549/terror-of-mount-velus?utm_source=api
