collector_number,name,mana_cost,cmc,type_line,rarity,colors,color_identity,oracle_text,power,toughness,loyalty,keywords,set_name,released_at,scryfall_uri
550,Volley Veteran,{3}{R},4.0,Creature — Goblin Warrior,uncommon,R,R,"When this creature enters, it deals damage to target creature an opponent controls equal to the number of Goblins you control.",4,2,,,Foundations,2024-11-15,https://scryfall.com/card/fdn/550/volley-veteran?utm_source=api
551,Aggressive Mammoth,{3}{G}{G}{G},6.0,Creature — Elephant,rare,G,G,"Trample (This creature can deal excess combat damage to the player or planeswalker it's attacking.)
Other creatures you control have trample.",8,8,,Trample,Foundations,2024-11-15,https://scryfall.com/card/fdn/551/aggressive-mammoth?utm_source=api
552,Bear Cub,{1}{G},2.0,Creature — Bear,common,G,G,,2,2,,,Foundations,2024-11-15,https://scryfall.com/card/fdn/552/bear-cub?utm_source=api
553,Biogenic Upgrade,{4}{G}{G},6.0,Sorcery,uncommon,G,G,"Distribute three +1/+1 counters among one, two, or three target creatures, then double the number of +1/+1 counters on each of those creatures.",,,,,Foundations,2024-11-15,https://scryfall.com/card/fdn/553/biogenic-upgrade?utm_source=api
554,Druid of the Cowl,{1}{G},2.0,Creature — Elf Druid,common,G,G,{T}: Add {G}.,1,3,,,Foundations,2024-11-15,https://scryfall.com/card/fdn/554/druid-of-the-cowl?utm_source=api
555,Joraga Invocation,{4}{G}{G},6.0,Sorcery,uncommon,G,G,Each creature you control gets +3/+3 until end of turn and must be blocked this turn if able.,,,,,Foundations,2024-11-15,https://scryfall.com/card/fdn/555/joraga-invocation?utm_source=api
556,Magnigoth Sentry,{3}{G},4.0,Creature — Treefolk,common,G,G,Reach (This creature can block creatures with flying.),4,4,,Reach,Foundations,2024-11-15,https://scryfall.com/card/fdn/556/magnigoth-sentry?utm_source=api
557,New Horizons,{2}{G},3.0,Enchantment — Aura,common,G,G,"Enchant land
When this Aura enters, put a +1/+1 counter on target creature you control.
Enchanted land has ""{T}: Add two mana of any one color.""",,,,Enchant,Foundations,2024-11-15,https://scryfall.com/card/fdn/557/new-horizons?utm_source=api
558,Tajuru Pathwarden,{4}{G},5.0,Creature — Elf Warrior Ally,common,G,G,"Vigilance (Attacking doesn't cause this creature to tap.)
Trample (This creature can deal excess combat damage to the player or planeswalker it's attacking.)",5,4,,"Vigilance, Trample",Foundations,2024-11-15,https://scryfall.com/card/fdn/558/tajuru-pathwarden?utm_source=api
559,Thornweald Archer,{1}{G},2.0,Creature — Elf Archer,common,G,G,"Reach (This creature can block creatures with flying.)
Deathtouch (Any amount of damage this deals to a creature is enough to destroy it.)",2,1,,"Reach, Deathtouch",Foundations,2024-11-15,https://scryfall.com/card/fdn/559/thornweald-archer?utm_source=api
560,Thrashing Brontodon,{1}{G}{G},3.0,Creature — Dinosaur,uncommon,G,G,"{1}, Sacrifice this creature: Destroy target artifact or enchantment.",3,4,,,Foundations,2024-11-15,https://scryfall.com/card/fdn/560/thrashing-brontodon?utm_source=api
561,Wildheart Invoker,{2}{G}{G},4.0,Creature — Elf Shaman,common,G,G,{8}: Target creature gets +5/+5 and gains trample until end of turn. (It can deal excess combat damage to the player or planeswalker it's attacking.),4,3,,,Foundations,2024-11-15,https://scryfall.com/card/fdn/561/wildheart-invoker?utm_source=api
562,Goblin Firebomb,{1},1.0,Artifact,common,,,"Flash
{7}, {T}, Sacrifice this artifact: Destroy target permanent.",,,,Flash,Foundations,2024-11-15,https://scryfall.com/card/fdn/562/goblin-firebomb?utm_source=api
563,Pirate's Cutlass,{3},3.0,Artifact — Equipment,common,,,"When this Equipment enters, attach it to target Pirate you control.
Equipped creature gets +2/+1.
Equip {2} ({2}: Attach to target creature you control. Equip only as a sorcery.)",,,,Equip,Foundations,2024-11-15,https://scryfall.com/card/fdn/563/pirates-cutlass?utm_source=api
564,Uncharted Haven,,0.0,Land,common,,,"This land enters tapped. As it enters, choose a color.
{T}: Add one mana of the chosen color.",,,,,Foundations,2024-11-15,https://scryfall.com/card/fdn/564/uncharted-haven?utm_source=api
565,Angelic Destiny,{2}{W}{W},4.0,Enchantment — Aura,mythic,W,W,"Enchant creature
Enchanted creature gets +4/+4, has flying and first strike, and is an Angel in addition to its other types.
When enchanted creature dies, return this card to its owner's hand.",,,,Enchant,Foundations,2024-11-15,https://scryfall.com/card/fdn/565/angelic-destiny?utm_source=api
566,Archway Angel,{5}{W},6.0,Creature — Angel,uncommon,W,W,"Flying
When this creature enters, you gain 2 life for each Gate you control.",3,4,,Flying,Foundations,2024-11-15,https://scryfall.com/card/fdn/566/archway-angel?utm_source=api
567,Ballyrush Banneret,{1}{W},2.0,Creature — Kithkin Soldier,common,W,W,Kithkin spells and Soldier spells you cast cost {1} less to cast.,2,1,,,Foundations,2024-11-15,https://scryfall.com/card/fdn/567/ballyrush-banneret?utm_source=api
568,Charming Prince,{1}{W},2.0,Creature — Human Noble,rare,W,W,"When this creature enters, choose one —
• Scry 2.
• You gain 3 life.
• Exile another target creature you own. Return it to the battlefield under your control at the beginning of the next end step.",2,2,,Scry,Foundations,2024-11-15,https://scryfall.com/card/fdn/568/charming-prince?utm_source=api
569,Crusader of Odric,{2}{W},3.0,Creature — Human Soldier,common,W,W,Crusader of Odric's power and toughness are each equal to the number of creatures you control.,*,*,,,Foundations,2024-11-15,https://scryfall.com/card/fdn/569/crusader-of-odric?utm_source=api
570,Dawnwing Marshal,{1}{W},2.0,Creature — Cat Soldier,uncommon,W,W,"Flying
{4}{W}: Creatures you control get +1/+1 until end of turn.",2,2,,Flying,Foundations,2024-11-15,https://scryfall.com/card/fdn/570/dawnwing-marshal?utm_source=api
571,Devout Decree,{1}{W},2.0,Sorcery,uncommon,W,W,Exile target creature or planeswalker that's black or red. Scry 1. (Look at the top card of your library. You may put that card on the bottom.),,,,Scry,Foundations,2024-11-15,https://scryfall.com/card/fdn/571/devout-decree?utm_source=api
572,Disenchant,{1}{W},2.0,Instant,common,W,W,Destroy target artifact or enchantment.,,,,,Foundations,2024-11-15,https://scryfall.com/card/fdn/572/disenchant?utm_source=api
573,Felidar Cub,{1}{W},2.0,Creature — Cat Beast,common,W,W,Sacrifice this creature: Destroy target enchantment.,2,2,,,Foundations,2024-11-15,https://scryfall.com/card/fdn/573/felidar-cub?utm_source=api
574,Felidar Retreat,{3}{W},4.0,Enchantment,rare,W,W,"Landfall — Whenever a land you control enters, choose one —
• Create a 2/2 white Cat Beast creature token.
• Put a +1/+1 counter on each creature you control. Those creatures gain vigilance until end of turn.",,,,Landfall,Foundations,2024-11-15,https://scryfall.com/card/fdn/574/felidar-retreat?utm_source=api
575,Fumigate,{3}{W}{W},5.0,Sorcery,rare,W,W,Destroy all creatures. You gain 1 life for each creature destroyed this way.,,,,,Foundations,2024-11-15,https://scryfall.com/card/fdn/575/fumigate?utm_source=api
576,Knight of Grace,{1}{W},2.0,Creature — Human Knight,uncommon,W,W,"First strike (This creature deals combat damage before creatures without first strike.)
Hexproof from black (This creature can't be the target of black spells or abilities your opponents control.)
This creature gets +1/+0 as long as any player controls a black permanent.",2,2,,"Hexproof from, Hexproof, First strike",Foundations,2024-11-15,https://scryfall.com/card/fdn/576/knight-of-grace?utm_source=api
577,"Linden, the Steadfast Queen",{W}{W}{W},3.0,Legendary Creature — Human Noble,rare,W,W,"Vigilance (Attacking doesn't cause this creature to tap.)
Whenever a white creature you control attacks, you gain 1 life.",3,3,,Vigilance,Foundations,2024-11-15,https://scryfall.com/card/fdn/577/linden-the-steadfast-queen?utm_source=api
578,Mentor of the Meek,{2}{W},3.0,Creature — Human Soldier,rare,W,W,"Whenever another creature you control with power 2 or less enters, you may pay {1}. If you do, draw a card.",2,2,,,Foundations,2024-11-15,https://scryfall.com/card/fdn/578/mentor-of-the-meek?utm_source=api
579,Regal Caracal,{3}{W}{W},5.0,Creature — Cat,rare,W,W,"Other Cats you control get +1/+1 and have lifelink. (Damage dealt by those creatures also causes you to gain that much life.)
When this creature enters, create two 1/1 white Cat creature tokens with lifelink.",3,3,,,Foundations,2024-11-15,https://scryfall.com/card/fdn/579/regal-caracal?utm_source=api
580,Release the Dogs,{3}{W},4.0,Sorcery,uncommon,W,W,Create four 1/1 white Dog creature tokens.,,,,,Foundations,2024-11-15,https://scryfall.com/card/fdn/580/release-the-dogs?utm_source=api
581,Stasis Snare,{1}{W}{W},3.0,Enchantment,uncommon,W,W,"Flash (You may cast this spell any time you could cast an instant.)
When this enchantment enters, exile target creature an opponent controls until this enchantment leaves the battlefield.",,,,Flash,Foundations,2024-11-15,https://scryfall.com/card/fdn/581/stasis-snare?utm_source=api
582,"Syr Alin, the Lion's Claw",{3}{W}{W},5.0,Legendary Creature — Human Knight,uncommon,W,W,"First strike (This creature deals combat damage before creatures without first strike.)
Whenever Syr Alin attacks, other creatures you control get +1/+1 until end of turn.",4,4,,First strike,Foundations,2024-11-15,https://scryfall.com/card/fdn/582/syr-alin-the-lions-claw?utm_source=api
583,Valorous Stance,{1}{W},2.0,Instant,uncommon,W,W,"Choose one —
• Target creature gains indestructible until end of turn. (Damage and effects that say ""destroy"" don't destroy it.)
• Destroy target creature with toughness 4 or greater.",,,,,Foundations,2024-11-15,https://scryfall.com/card/fdn/583/valorous-stance?utm_source=api
584,"Zetalpa, Primal Dawn",{6}{W}{W},8.0,Legendary Creature — Elder Dinosaur,rare,W,W,"Flying, double strike, vigilance, trample, indestructible",4,8,,"Flying, Indestructible, Vigilance, Trample, Double strike",Foundations,2024-11-15,https://scryfall.com/card/fdn/584/zetalpa-primal-dawn?utm_source=api
585,Arcanis the Omnipotent,{3}{U}{U}{U},6.0,Legendary Creature — Wizard,rare,U,U,"{T}: Draw three cards.
{2}{U}{U}: Return Arcanis to its owner's hand.",3,4,,,Foundations,2024-11-15,https://scryfall.com/card/fdn/585/arcanis-the-omnipotent?utm_source=api
586,Chart a Course,{1}{U},2.0,Sorcery,uncommon,U,U,Draw two cards. Then discard a card unless you attacked this turn.,,,,,Foundations,2024-11-15,https://scryfall.com/card/fdn/586/chart-a-course?utm_source=api
587,Dictate of Kruphix,{1}{U}{U},3.0,Enchantment,rare,U,U,"Flash (You may cast this spell any time you could cast an instant.)
At the beginning of each player's draw step, that player draws an additional card.",,,,Flash,Foundations,2024-11-15,https://scryfall.com/card/fdn/587/dictate-of-kruphix?utm_source=api
588,Dive Down,{U},1.0,Instant,common,U,U,Target creature you control gets +0/+3 and gains hexproof until end of turn. (It can't be the target of spells or abilities your opponents control.),,,,,Foundations,2024-11-15,https://scryfall.com/card/fdn/588/dive-down?utm_source=api
589,Finale of Revelation,{X}{U}{U},2.0,Sorcery,mythic,U,U,"Draw X cards. If X is 10 or more, instead shuffle your graveyard into your library, draw X cards, untap up to five lands, and you have no maximum hand size for the rest of the game.
Exile Finale of Revelation.",,,,,Foundations,2024-11-15,https://scryfall.com/card/fdn/589/finale-of-revelation?utm_source=api
590,Flashfreeze,{1}{U},2.0,Instant,uncommon,U,U,Counter target red or green spell.,,,,,Foundations,2024-11-15,https://scryfall.com/card/fdn/590/flashfreeze?utm_source=api
591,Fog Bank,{1}{U},2.0,Creature — Wall,uncommon,U,U,"Defender (This creature can't attack.)
Flying
Prevent all combat damage that would be dealt to and dealt by this creature.",0,2,,"Flying, Defender",Foundations,2024-11-15,https://scryfall.com/card/fdn/591/fog-bank?utm_source=api
592,Gateway Sneak,{2}{U},3.0,Creature — Vedalken Rogue,uncommon,U,U,"Whenever a Gate you control enters, this creature can't be blocked this turn.
Whenever this creature deals combat damage to a player, draw a card.",1,3,,,Foundations,2024-11-15,https://scryfall.com/card/fdn/592/gateway-sneak?utm_source=api
593,Harbinger of the Tides,{U}{U},2.0,Creature — Merfolk Wizard,rare,U,U,"You may cast this spell as though it had flash if you pay {2} more to cast it. (You may cast it any time you could cast an instant.)
When this creature enters, you may return target tapped creature an opponent controls to its owner's hand.",2,2,,,Foundations,2024-11-15,https://scryfall.com/card/fdn/593/harbinger-of-the-tides?utm_source=api
594,Mystical Teachings,{3}{U},4.0,Instant,uncommon,U,"B, U","Search your library for an instant card or a card with flash, reveal it, put it into your hand, then shuffle.
Flashback {5}{B} (You may cast this card from your graveyard for its flashback cost. Then exile it.)",,,,Flashback,Foundations,2024-11-15,https://scryfall.com/card/fdn/594/mystical-teachings?utm_source=api
595,River's Rebuke,{4}{U}{U},6.0,Sorcery,rare,U,U,Return all nonland permanents target player controls to their owner's hand.,,,,,Foundations,2024-11-15,https://scryfall.com/card/fdn/595/rivers-rebuke?utm_source=api
596,Shipwreck Dowser,{3}{U}{U},5.0,Creature — Merfolk Wizard,uncommon,U,U,"Prowess (Whenever you cast a noncreature spell, this creature gets +1/+1 until end of turn.)
When this creature enters, return target instant or sorcery card from your graveyard to your hand.",3,3,,Prowess,Foundations,2024-11-15,https://scryfall.com/card/fdn/596/shipwreck-dowser?utm_source=api
597,Sphinx of the Final Word,{5}{U}{U},7.0,Creature — Sphinx,mythic,U,U,"This spell can't be countered.
Flying
Hexproof (This creature can't be the target of spells or abilities your opponents control.)
Instant and sorcery spells you control can't be countered.",5,5,,"Flying, Hexproof",Foundations,2024-11-15,https://scryfall.com/card/fdn/597/sphinx-of-the-final-word?utm_source=api
598,Tempest Djinn,{U}{U}{U},3.0,Creature — Djinn,rare,U,U,"Flying
This creature gets +1/+0 for each basic Island you control.",0,4,,Flying,Foundations,2024-11-15,https://scryfall.com/card/fdn/598/tempest-djinn?utm_source=api
599,Unsummon,{U},1.0,Instant,common,U,U,Return target creature to its owner's hand.,,,,,Foundations,2024-11-15,https://scryfall.com/card/fdn/599/unsummon?utm_source=api
600,Voracious Greatshark,{3}{U}{U},5.0,Creature — Shark,rare,U,U,"Flash (You may cast this spell any time you could cast an instant.)
When this creature enters, counter target artifact or creature spell.",5,4,,Flash,Foundations,2024-11-15,https://scryfall.com/card/fdn/600/voracious-greatshark?utm_source=api
601,Deathmark,{B},1.0,Sorcery,uncommon,B,B,Destroy target green or white creature.,,,,,Foundations,2024-11-15,https://scryfall.com/card/fdn/601/deathmark?utm_source=api
602,Demonic Pact,{2}{B}{B},4.0,Enchantment,mythic,B,B,"At the beginning of your upkeep, choose one that hasn't been chosen —
• This enchantment deals 4 damage to any target and you gain 4 life.
• Target opponent discards two cards.
• Draw two cards.
• You lose the game.",,,,,Foundations,2024-11-15,https://scryfall.com/card/fdn/602/demonic-pact?utm_source=api
603,Desecration Demon,{2}{B}{B},4.0,Creature — Demon,rare,B,B,"Flying
At the beginning of each combat, any opponent may sacrifice a creature of their choice. If a player does, tap this creature and put a +1/+1 counter on it.",6,6,,Flying,Foundations,2024-11-15,https://scryfall.com/card/fdn/603/desecration-demon?utm_source=api
604,Dread Summons,{X}{B}{B},2.0,Sorcery,rare,B,B,"Each player mills X cards. For each creature card put into a graveyard this way, you create a tapped 2/2 black Zombie creature token. (To mill a card, a player puts the top card of their library into their graveyard.)",,,,Mill,Foundations,2024-11-15,https://scryfall.com/card/fdn/604/dread-summons?utm_source=api
605,Driver of the Dead,{3}{B},4.0,Creature — Vampire,common,B,B,"When this creature dies, return target creature card with mana value 2 or less from your graveyard to the battlefield.",3,2,,,Foundations,2024-11-15,https://scryfall.com/card/fdn/605/driver-of-the-dead?utm_source=api
606,Duress,{B},1.0,Sorcery,common,B,B,"Target opponent reveals their hand. You choose a noncreature, nonland card from it. That player discards that card.",,,,,Foundations,2024-11-15,https://scryfall.com/card/fdn/606/duress?utm_source=api
607,Kalastria Highborn,{B}{B},2.0,Creature — Vampire Shaman,rare,B,B,"Whenever this creature or another Vampire you control dies, you may pay {B}. If you do, target player loses 2 life and you gain 2 life.",2,2,,,Foundations,2024-11-15,https://scryfall.com/card/fdn/607/kalastria-highborn?utm_source=api
608,Knight of Malice,{1}{B},2.0,Creature — Human Knight,uncommon,B,B,"First strike (This creature deals combat damage before creatures without first strike.)
Hexproof from white (This creature can't be the target of white spells or abilities your opponents control.)
This creature gets +1/+0 as long as any player controls a white permanent.",2,2,,"Hexproof from, Hexproof, First strike",Foundations,2024-11-15,https://scryfall.com/card/fdn/608/knight-of-malice?utm_source=api
609,Midnight Reaper,{2}{B},3.0,Creature — Zombie Knight,rare,B,B,"Whenever a nontoken creature you control dies, this creature deals 1 damage to you and you draw a card.",3,2,,,Foundations,2024-11-15,https://scryfall.com/card/fdn/609/midnight-reaper?utm_source=api
610,Myojin of Night's Reach,{5}{B}{B}{B},8.0,Legendary Creature — Spirit,rare,B,B,"Myojin of Night's Reach enters with a divinity counter on it if you cast it from your hand.
Myojin of Night's Reach has indestructible as long as it has a divinity counter on it.
Remove a divinity counter from Myojin of Night's Reach: Each opponent discards their hand.",5,2,,,Foundations,2024-11-15,https://scryfall.com/card/fdn/610/myojin-of-nights-reach?utm_source=api
611,Nullpriest of Oblivion,{1}{B},2.0,Creature — Vampire Cleric,rare,B,B,"Kicker {3}{B} (You may pay an additional {3}{B} as you cast this spell.)
Lifelink
Menace (This creature can't be blocked except by two or more creatures.)
When this creature enters, if it was kicked, return target creature card from your graveyard to the battlefield.",2,1,,"Lifelink, Menace, Kicker",Foundations,2024-11-15,https://scryfall.com/card/fdn/611/nullpriest-of-oblivion?utm_source=api
612,Pulse Tracker,{B},1.0,Creature — Vampire Rogue,common,B,B,"Whenever this creature attacks, each opponent loses 1 life.",1,1,,,Foundations,2024-11-15,https://scryfall.com/card/fdn/612/pulse-tracker?utm_source=api
613,Sanguine Indulgence,{3}{B},4.0,Sorcery,common,B,B,"This spell costs {3} less to cast if you've gained 3 or more life this turn.
Return up to two target creature cards from your graveyard to your hand.",,,,,Foundations,2024-11-15,https://scryfall.com/card/fdn/613/sanguine-indulgence?utm_source=api
614,Tribute to Hunger,{2}{B},3.0,Instant,uncommon,B,B,Target opponent sacrifices a creature of their choice. You gain life equal to that creature's toughness.,,,,,Foundations,2024-11-15,https://scryfall.com/card/fdn/614/tribute-to-hunger?utm_source=api
615,Vampiric Rites,{B},1.0,Enchantment,uncommon,B,B,"{1}{B}, Sacrifice a creature: You gain 1 life and draw a card.",,,,,Foundations,2024-11-15,https://scryfall.com/card/fdn/615/vampiric-rites?utm_source=api
616,Vile Entomber,{2}{B}{B},4.0,Creature — Zombie Warlock,uncommon,B,B,"Deathtouch (Any amount of damage this deals to a creature is enough to destroy it.)
When this creature enters, search your library for a card, put that card into your graveyard, then shuffle.",2,2,,Deathtouch,Foundations,2024-11-15,https://scryfall.com/card/fdn/616/vile-entomber?utm_source=api
617,Wishclaw Talisman,{1}{B},2.0,Artifact,rare,B,B,"This artifact enters with three wish counters on it.
{1}, {T}, Remove a wish counter from this artifact: Search your library for a card, put it into your hand, then shuffle. An opponent gains control of this artifact. Activate only during your turn.",,,,,Foundations,2024-11-15,https://scryfall.com/card/fdn/617/wishclaw-talisman?utm_source=api
618,Ball Lightning,{R}{R}{R},3.0,Creature — Elemental,rare,R,R,"Trample (This creature can deal excess combat damage to the player or planeswalker it's attacking.)
Haste (This creature can attack and {T} as soon as it comes under your control.)
At the beginning of the end step, sacrifice this creature.",6,1,,"Haste, Trample",Foundations,2024-11-15,https://scryfall.com/card/fdn/618/ball-lightning?utm_source=api
619,Bolt Bend,{3}{R},4.0,Instant,uncommon,R,R,"This spell costs {3} less to cast if you control a creature with power 4 or greater.
Change the target of target spell or ability with a single target.",,,,,Foundations,2024-11-15,https://scryfall.com/card/fdn/619/bolt-bend?utm_source=api
620,Crash Through,{R},1.0,Sorcery,common,R,R,"Creatures you control gain trample until end of turn. (Each of those creatures can deal excess combat damage to the player or planeswalker it's attacking.)
Draw a card.",,,,,Foundations,2024-11-15,https://scryfall.com/card/fdn/620/crash-through?utm_source=api
621,Dragon Mage,{5}{R}{R},7.0,Creature — Dragon Wizard,uncommon,R,R,"Flying
Whenever this creature deals combat damage to a player, each player discards their hand, then draws seven cards.",5,5,,Flying,Foundations,2024-11-15,https://scryfall.com/card/fdn/621/dragon-mage?utm_source=api
622,Dragonmaster Outcast,{R},1.0,Creature — Human Shaman,mythic,R,R,"At the beginning of your upkeep, if you control six or more lands, create a 5/5 red Dragon creature token with flying.",1,1,,,Foundations,2024-11-15,https://scryfall.com/card/fdn/622/dragonmaster-outcast?utm_source=api
623,Ghitu Lavarunner,{R},1.0,Creature — Human Wizard,common,R,R,"As long as there are two or more instant and/or sorcery cards in your graveyard, this creature gets +1/+0 and has haste. (It can attack and {T} as soon as it comes under your control.)",1,2,,,Foundations,2024-11-15,https://scryfall.com/card/fdn/623/ghitu-lavarunner?utm_source=api
624,Giant Cindermaw,{2}{R},3.0,Creature — Dinosaur Beast,uncommon,R,R,"Trample (This creature can deal excess combat damage to the player or planeswalker it's attacking.)
Players can't gain life.",4,3,,Trample,Foundations,2024-11-15,https://scryfall.com/card/fdn/624/giant-cindermaw?utm_source=api
625,Harmless Offering,{2}{R},3.0,Sorcery,rare,R,R,Target opponent gains control of target permanent you control.,,,,,Foundations,2024-11-15,https://scryfall.com/card/fdn/625/harmless-offering?utm_source=api
626,Hoarding Dragon,{3}{R}{R},5.0,Creature — Dragon,uncommon,R,R,"Flying
When this creature enters, you may search your library for an artifact card, exile it, then shuffle.
When this creature dies, you may put the exiled card into its owner's hand.",4,4,,Flying,Foundations,2024-11-15,https://scryfall.com/card/fdn/626/hoarding-dragon?utm_source=api
627,"Lathliss, Dragon Queen",{4}{R}{R},6.0,Legendary Creature — Dragon,rare,R,R,"Flying
Whenever another nontoken Dragon you control enters, create a 5/5 red Dragon creature token with flying.
{1}{R}: Dragons you control get +1/+0 until end of turn.",6,6,,Flying,Foundations,2024-11-15,https://scryfall.com/card/fdn/627/lathliss-dragon-queen?utm_source=api
628,Mindsparker,{1}{R}{R},3.0,Creature — Elemental,uncommon,R,R,"First strike (This creature deals combat damage before creatures without first strike.)
Whenever an opponent casts a white or blue instant or sorcery spell, this creature deals 2 damage to that player.",3,2,,First strike,Foundations,2024-11-15,https://scryfall.com/card/fdn/628/mindsparker?utm_source=api
629,Obliterating Bolt,{1}{R},2.0,Sorcery,uncommon,R,R,"Obliterating Bolt deals 4 damage to target creature or planeswalker. If that creature or planeswalker would die this turn, exile it instead.",,,,,Foundations,2024-11-15,https://scryfall.com/card/fdn/629/obliterating-bolt?utm_source=api
630,Ravenous Giant,{2}{R}{R},4.0,Creature — Giant,uncommon,R,R,"At the beginning of your upkeep, this creature deals 1 damage to you.",5,5,,,Foundations,2024-11-15,https://scryfall.com/card/fdn/630/ravenous-giant?utm_source=api
631,Redcap Gutter-Dweller,{2}{R}{R},4.0,Creature — Goblin Warrior,rare,R,R,"Menace
When this creature enters, create two 1/1 black Rat creature tokens with ""This token can't block.""
At the beginning of your upkeep, you may sacrifice another creature. If you do, put a +1/+1 counter on this creature and exile the top card of your library. You may play that card this turn.",3,3,,Menace,Foundations,2024-11-15,https://scryfall.com/card/fdn/631/redcap-gutter-dweller?utm_source=api
632,Stromkirk Noble,{R},1.0,Creature — Vampire Noble,rare,R,R,"This creature can't be blocked by Humans.
Whenever this creature deals combat damage to a player, put a +1/+1 counter on it.",1,1,,,Foundations,2024-11-15,https://scryfall.com/card/fdn/632/stromkirk-noble?utm_source=api
633,Taurean Mauler,{2}{R},3.0,Creature — Shapeshifter,rare,R,R,"Changeling (This card is every creature type.)
Whenever an opponent casts a spell, you may put a +1/+1 counter on this creature.",2,2,,Changeling,Foundations,2024-11-15,https://scryfall.com/card/fdn/633/taurean-mauler?utm_source=api
634,Viashino Pyromancer,{1}{R},2.0,Creature — Lizard Wizard,common,R,R,"When this creature enters, it deals 2 damage to target player or planeswalker.",2,1,,,Foundations,2024-11-15,https://scryfall.com/card/fdn/634/viashino-pyromancer?utm_source=api
635,Circuitous Route,{3}{G},4.0,Sorcery,uncommon,G,G,"Search your library for up to two basic land cards and/or Gate cards, put them onto the battlefield tapped, then shuffle.",,,,,Foundations,2024-11-15,https://scryfall.com/card/fdn/635/circuitous-route?utm_source=api
