collector_number,name,mana_cost,cmc,type_line,rarity,colors,color_identity,oracle_text,power,toughness,loyalty,keywords,set_name,released_at,scryfall_uri
209,Tapestry Warden,{3}{G},4.0,Artifact Creature — Robot Soldier,uncommon,G,G,"Vigilance
Each creature you control with toughness greater than its power assigns combat damage equal to its toughness rather than its power.
Each creature you control with toughness greater than its power stations permanents using its toughness rather than its power.",3,4,,Vigilance,Edge of Eternities,2025-08-01,https://scryfall.com/card/eoe/209/tapestry-warden?utm_source=api
210,Terrasymbiosis,{2}{G},3.0,Enchantment,rare,G,G,"Whenever you put one or more +1/+1 counters on a creature you control, you may draw that many cards. Do this only once each turn.",,,,,Edge of Eternities,2025-08-01,https://scryfall.com/card/eoe/210/terrasymbiosis?utm_source=api
211,Thawbringer,{2}{G},3.0,Creature — Insect Scout,common,G,G,"When this creature enters or dies, surveil 1. (Look at the top card of your library. You may put it into your graveyard.)",4,2,,Surveil,Edge of Eternities,2025-08-01,https://scryfall.com/card/eoe/211/thawbringer?utm_source=api
212,"Alpharael, Dreaming Acolyte",{1}{U}{B},3.0,Legendary Creature — Human Cleric,uncommon,"B, U","B, U","When Alpharael enters, draw two cards. Then discard two cards unless you discard an artifact card.
During your turn, Alpharael has deathtouch.",2,3,,,Edge of Eternities,2025-08-01,https://scryfall.com/card/eoe/212/alpharael-dreaming-acolyte?utm_source=api
213,Biomechan Engineer,{G}{U},2.0,Creature — Insect Artificer,uncommon,"G, U","G, U","When this creature enters, create a Lander token. (It's an artifact with ""{2}, {T}, Sacrifice this token: Search your library for a basic land card, put it onto the battlefield tapped, then shuffle."")
{8}: Draw two cards and create a 2/2 colorless Robot artifact creature token.",2,2,,,Edge of Eternities,2025-08-01,https://scryfall.com/card/eoe/213/biomechan-engineer?utm_source=api
214,Biotech Specialist,{R}{G},2.0,Creature — Insect Scientist,rare,"G, R","G, R","When this creature enters, create a Lander token. (It's an artifact with ""{2}, {T}, Sacrifice this token: Search your library for a basic land card, put it onto the battlefield tapped, then shuffle."")
Whenever you sacrifice an artifact, this creature deals 2 damage to target opponent.",1,3,,,Edge of Eternities,2025-08-01,https://scryfall.com/card/eoe/214/biotech-specialist?utm_source=api
215,Cosmogoyf,{B}{G},2.0,Creature — Elemental Lhurgoyf,rare,"B, G","B, G",Cosmogoyf's power is equal to the number of cards you own in exile and its toughness is equal to that number plus 1.,*,1+*,,,Edge of Eternities,2025-08-01,https://scryfall.com/card/eoe/215/cosmogoyf?utm_source=api
216,"Dyadrine, Synthesis Amalgam",{X}{G}{W},2.0,Legendary Artifact Creature — Construct,rare,"G, W","G, W","Trample
Dyadrine enters with a number of +1/+1 counters on it equal to the amount of mana spent to cast it.
Whenever you attack, you may remove a +1/+1 counter from each of two creatures you control. If you do, draw a card and create a 2/2 colorless Robot artifact creature token.",0,1,,Trample,Edge of Eternities,2025-08-01,https://scryfall.com/card/eoe/216/dyadrine-synthesis-amalgam?utm_source=api
217,Genemorph Imago,{G}{U},2.0,Creature — Insect Druid,rare,"G, U","G, U","Flying
Landfall — Whenever a land you control enters, target creature has base power and toughness 3/3 until end of turn. If you control six or more lands, that creature has base power and toughness 6/6 until end of turn instead.",1,3,,"Landfall, Flying",Edge of Eternities,2025-08-01,https://scryfall.com/card/eoe/217/genemorph-imago?utm_source=api
218,"Haliya, Ascendant Cadet",{2}{G}{W}{W},5.0,Legendary Creature — Human Soldier,uncommon,"G, W","G, W","Whenever Haliya enters or attacks, put a +1/+1 counter on target creature you control.
Whenever one or more creatures you control with +1/+1 counters on them deal combat damage to a player, draw a card.",3,3,,,Edge of Eternities,2025-08-01,https://scryfall.com/card/eoe/218/haliya-ascendant-cadet?utm_source=api
219,Infinite Guideline Station,{W}{U}{B}{R}{G},5.0,Legendary Artifact — Spacecraft,rare,"B, G, R, U, W","B, G, R, U, W","When Infinite Guideline Station enters, create a tapped 2/2 colorless Robot artifact creature token for each multicolored permanent you control.
Station (Tap another creature you control: Put charge counters equal to its power on this Spacecraft. Station only as a sorcery. It's an artifact creature at 12+.)
12+ | Flying
Whenever Infinite Guideline Station attacks, draw a card for each multicolored permanent you control.",7,15,,Station,Edge of Eternities,2025-08-01,https://scryfall.com/card/eoe/219/infinite-guideline-station?utm_source=api
220,Interceptor Mechan,{2}{B}{R},4.0,Artifact Creature — Robot,uncommon,"B, R","B, R","Flying
When this creature enters, return target artifact or creature card from your graveyard to your hand.
Void — At the beginning of your end step, if a nonland permanent left the battlefield this turn or a spell was warped this turn, put a +1/+1 counter on this creature.",2,2,,"Flying, Void",Edge of Eternities,2025-08-01,https://scryfall.com/card/eoe/220/interceptor-mechan?utm_source=api
221,"Mm'menon, Uthros Exile",{1}{U}{R},3.0,Legendary Creature — Jellyfish Advisor,uncommon,"R, U","R, U","Flying
Whenever an artifact you control enters, put a +1/+1 counter on target creature.",1,3,,Flying,Edge of Eternities,2025-08-01,https://scryfall.com/card/eoe/221/mmmenon-uthros-exile?utm_source=api
222,Mutinous Massacre,{3}{B}{B}{R}{R},7.0,Sorcery,rare,"B, R","B, R",Choose odd or even. Destroy each creature with mana value of the chosen quality. Then gain control of all creatures until end of turn. Untap them. They gain haste until end of turn. (Zero is even.),,,,,Edge of Eternities,2025-08-01,https://scryfall.com/card/eoe/222/mutinous-massacre?utm_source=api
223,Pinnacle Emissary,{1}{U}{R},3.0,Artifact Creature — Robot,rare,"R, U","R, U","Whenever you cast an artifact spell, create a 1/1 colorless Drone artifact creature token with flying and ""This token can block only creatures with flying.""
Warp {U/R} (You may cast this card from your hand for its warp cost. Exile this creature at the beginning of the next end step, then you may cast it from exile on a later turn.)",3,3,,Warp,Edge of Eternities,2025-08-01,https://scryfall.com/card/eoe/223/pinnacle-emissary?utm_source=api
224,"Ragost, Deft Gastronaut",{R}{W},2.0,Legendary Creature — Lobster Citizen,rare,"R, W","R, W","Artifacts you control are Foods in addition to their other types and have ""{2}, {T}, Sacrifice this artifact: You gain 3 life.""
{1}, {T}, Sacrifice a Food: Ragost deals 3 damage to each opponent.
At the beginning of each end step, if you gained life this turn, untap Ragost.",2,2,,,Edge of Eternities,2025-08-01,https://scryfall.com/card/eoe/224/ragost-deft-gastronaut?utm_source=api
225,"Sami, Ship's Engineer",{2}{R}{W},4.0,Legendary Creature — Human Artificer,uncommon,"R, W","R, W","At the beginning of your end step, if you control two or more tapped creatures, create a tapped 2/2 colorless Robot artifact creature token.",2,4,,,Edge of Eternities,2025-08-01,https://scryfall.com/card/eoe/225/sami-ships-engineer?utm_source=api
226,"Sami, Wildcat Captain",{4}{R}{W},6.0,Legendary Creature — Human Artificer Rogue,mythic,"R, W","R, W","Double strike, vigilance
Spells you cast have affinity for artifacts. (They cost {1} less to cast for each artifact you control.)",4,4,,"Vigilance, Double strike",Edge of Eternities,2025-08-01,https://scryfall.com/card/eoe/226/sami-wildcat-captain?utm_source=api
227,Seedship Broodtender,{B}{G},2.0,Creature — Insect Citizen,uncommon,"B, G","B, G","When this creature enters, mill three cards. (Put the top three cards of your library into your graveyard.)
{3}{B}{G}, Sacrifice this creature: Return target creature or Spacecraft card from your graveyard to the battlefield. Activate only as a sorcery.",2,3,,Mill,Edge of Eternities,2025-08-01,https://scryfall.com/card/eoe/227/seedship-broodtender?utm_source=api
228,Singularity Rupture,{3}{U}{B}{B},6.0,Sorcery,rare,"B, U","B, U","Destroy all creatures, then any number of target players each mill half their library, rounded down.",,,,Mill,Edge of Eternities,2025-08-01,https://scryfall.com/card/eoe/228/singularity-rupture?utm_source=api
229,Space-Time Anomaly,{2}{W}{U},4.0,Sorcery,rare,"U, W","U, W",Target player mills cards equal to your life total.,,,,Mill,Edge of Eternities,2025-08-01,https://scryfall.com/card/eoe/229/space-time-anomaly?utm_source=api
230,Station Monitor,{W}{U},2.0,Creature — Lizard Artificer,uncommon,"U, W","U, W","Whenever you cast your second spell each turn, create a 1/1 colorless Drone artifact creature token with flying and ""This token can block only creatures with flying.""",2,2,,,Edge of Eternities,2025-08-01,https://scryfall.com/card/eoe/230/station-monitor?utm_source=api
231,"Syr Vondam, Sunstar Exemplar",{W}{B},2.0,Legendary Creature — Human Knight,rare,"B, W","B, W","Vigilance, menace
Whenever another creature you control dies or is put into exile, put a +1/+1 counter on Syr Vondam and you gain 1 life.
When Syr Vondam dies or is put into exile while its power is 4 or greater, destroy up to one target nonland permanent.",2,2,,"Vigilance, Menace",Edge of Eternities,2025-08-01,https://scryfall.com/card/eoe/231/syr-vondam-sunstar-exemplar?utm_source=api
232,"Syr Vondam, the Lucent",{2}{W}{B}{B},5.0,Legendary Creature — Human Knight,uncommon,"B, W","B, W","Deathtouch, lifelink
Whenever Syr Vondam enters or attacks, other creatures you control get +1/+0 and gain deathtouch until end of turn.",4,4,,"Lifelink, Deathtouch",Edge of Eternities,2025-08-01,https://scryfall.com/card/eoe/232/syr-vondam-the-lucent?utm_source=api
233,"Tannuk, Memorial Ensign",{1}{R}{G},3.0,Legendary Creature — Kavu Pilot,uncommon,"G, R","G, R","Landfall — Whenever a land you control enters, Tannuk deals 1 damage to each opponent. If this is the second time this ability has resolved this turn, draw a card.",2,4,,Landfall,Edge of Eternities,2025-08-01,https://scryfall.com/card/eoe/233/tannuk-memorial-ensign?utm_source=api
234,All-Fates Scroll,{3},3.0,Artifact,uncommon,,,"{T}: Add one mana of any color.
{7}, {T}, Sacrifice this artifact: Draw X cards, where X is the number of differently named lands you control.",,,,,Edge of Eternities,2025-08-01,https://scryfall.com/card/eoe/234/all-fates-scroll?utm_source=api
235,Bygone Colossus,{9},9.0,Artifact Creature — Robot Giant,uncommon,,,"Warp {3} (You may cast this card from your hand for its warp cost. Exile this creature at the beginning of the next end step, then you may cast it from exile on a later turn.)",9,9,,Warp,Edge of Eternities,2025-08-01,https://scryfall.com/card/eoe/235/bygone-colossus?utm_source=api
236,Chrome Companion,{2},2.0,Artifact Creature — Dog,common,,,"Whenever this creature becomes tapped, you gain 1 life.
{2}, {T}: Put target card from a graveyard on the bottom of its owner's library.",2,1,,,Edge of Eternities,2025-08-01,https://scryfall.com/card/eoe/236/chrome-companion?utm_source=api
237,Dauntless Scrapbot,{3},3.0,Artifact Creature — Robot,uncommon,,,"When this creature enters, exile each opponent's graveyard. Create a Lander token. (It's an artifact with ""{2}, {T}, Sacrifice this token: Search your library for a basic land card, put it onto the battlefield tapped, then shuffle."")",3,1,,,Edge of Eternities,2025-08-01,https://scryfall.com/card/eoe/237/dauntless-scrapbot?utm_source=api
238,"Dawnsire, Sunstar Dreadnought",{5},5.0,Legendary Artifact — Spacecraft,mythic,,,"Station (Tap another creature you control: Put charge counters equal to its power on this Spacecraft. Station only as a sorcery. It's an artifact creature at 20+.)
10+ | Whenever you attack, Dawnsire deals 100 damage to up to one target creature or planeswalker.
20+ | Flying",20,20,,Station,Edge of Eternities,2025-08-01,https://scryfall.com/card/eoe/238/dawnsire-sunstar-dreadnought?utm_source=api
239,The Dominion Bracelet,{2},2.0,Legendary Artifact — Equipment,mythic,,,"Equipped creature gets +1/+1 and has ""{15}, Exile The Dominion Bracelet: You control target opponent during their next turn. This ability costs {X} less to activate, where X is this creature's power. Activate only as a sorcery."" (You see all cards that player could see and make all decisions for them.)
Equip {1}",,,,Equip,Edge of Eternities,2025-08-01,https://scryfall.com/card/eoe/239/the-dominion-bracelet?utm_source=api
240,The Endstone,{7},7.0,Legendary Artifact,mythic,,,"Whenever you play a land or cast a spell, draw a card.
At the beginning of your end step, your life total becomes half your starting life total, rounded up.",,,,,Edge of Eternities,2025-08-01,https://scryfall.com/card/eoe/240/the-endstone?utm_source=api
241,The Eternity Elevator,{5},5.0,Legendary Artifact — Spacecraft,rare,,,"{T}: Add {C}{C}{C}.
Station (Tap another creature you control: Put charge counters equal to its power on this Spacecraft. Station only as a sorcery.)
20+ | {T}: Add X mana of any one color, where X is the number of charge counters on The Eternity Elevator.",,,,Station,Edge of Eternities,2025-08-01,https://scryfall.com/card/eoe/241/the-eternity-elevator?utm_source=api
242,Extinguisher Battleship,{8},8.0,Artifact — Spacecraft,rare,,,"When this Spacecraft enters, destroy target noncreature permanent. Then this Spacecraft deals 4 damage to each creature.
Station (Tap another creature you control: Put charge counters equal to its power on this Spacecraft. Station only as a sorcery. It's an artifact creature at 5+.)
5+ | Flying, trample",10,10,,Station,Edge of Eternities,2025-08-01,https://scryfall.com/card/eoe/242/extinguisher-battleship?utm_source=api
243,Nutrient Block,{1},1.0,Artifact — Food,common,,,"Indestructible (Effects that say ""destroy"" don't destroy this artifact.)
{2}, {T}, Sacrifice this artifact: You gain 3 life.
When this artifact is put into a graveyard from the battlefield, draw a card.",,,,Indestructible,Edge of Eternities,2025-08-01,https://scryfall.com/card/eoe/243/nutrient-block?utm_source=api
244,Pinnacle Kill-Ship,{7},7.0,Artifact — Spacecraft,common,,,"When this Spacecraft enters, it deals 10 damage to up to one target creature.
Station (Tap another creature you control: Put charge counters equal to its power on this Spacecraft. Station only as a sorcery. It's an artifact creature at 7+.)
7+ | Flying",7,7,,Station,Edge of Eternities,2025-08-01,https://scryfall.com/card/eoe/244/pinnacle-kill-ship?utm_source=api
245,Survey Mechan,{4},4.0,Artifact Creature — Robot,uncommon,,,"Flying
Hexproof (This creature can't be the target of spells or abilities your opponents control.)
{10}, Sacrifice this creature: It deals 3 damage to any target. Target player draws three cards and gains 3 life. This ability costs {X} less to activate, where X is the number of differently named lands you control.",1,3,,"Flying, Hexproof",Edge of Eternities,2025-08-01,https://scryfall.com/card/eoe/245/survey-mechan?utm_source=api
246,Thaumaton Torpedo,{1},1.0,Artifact,common,,,"{6}, {T}, Sacrifice this artifact: Destroy target nonland permanent. This ability costs {3} less to activate if you attacked with a Spacecraft this turn.",,,,,Edge of Eternities,2025-08-01,https://scryfall.com/card/eoe/246/thaumaton-torpedo?utm_source=api
247,Thrumming Hivepool,{6},6.0,Artifact,rare,,,"Affinity for Slivers (This spell costs {1} less to cast for each Sliver you control.)
Slivers you control have double strike and haste.
At the beginning of your upkeep, create two 1/1 colorless Sliver creature tokens.",,,,Affinity,Edge of Eternities,2025-08-01,https://scryfall.com/card/eoe/247/thrumming-hivepool?utm_source=api
248,Virulent Silencer,{3},3.0,Artifact Creature — Robot Assassin,uncommon,,,"Whenever a nontoken artifact creature you control deals combat damage to a player, that player gets two poison counters. (A player with ten or more poison counters loses the game.)",2,3,,,Edge of Eternities,2025-08-01,https://scryfall.com/card/eoe/248/virulent-silencer?utm_source=api
249,Wurmwall Sweeper,{2},2.0,Artifact — Spacecraft,common,,,"When this Spacecraft enters, surveil 2.
Station (Tap another creature you control: Put charge counters equal to its power on this Spacecraft. Station only as a sorcery. It's an artifact creature at 4+.)
4+ | Flying",2,2,,"Surveil, Station",Edge of Eternities,2025-08-01,https://scryfall.com/card/eoe/249/wurmwall-sweeper?utm_source=api
250,"Adagia, Windswept Bastion",,0.0,Land — Planet,mythic,,W,"This land enters tapped.
{T}: Add {W}.
Station (Tap another creature you control: Put charge counters equal to its power on this Planet. Station only as a sorcery.)
12+ | {3}{W}, {T}: Create a token that's a copy of target artifact or enchantment you control, except it's legendary. Activate only as a sorcery.",,,,Station,Edge of Eternities,2025-08-01,https://scryfall.com/card/eoe/250/adagia-windswept-bastion?utm_source=api
251,Breeding Pool,,0.0,Land — Forest Island,rare,,"G, U","({T}: Add {G} or {U}.)
As this land enters, you may pay 2 life. If you don't, it enters tapped.",,,,,Edge of Eternities,2025-08-01,https://scryfall.com/card/eoe/251/breeding-pool?utm_source=api
252,Command Bridge,,0.0,Land,common,,,"This land enters tapped.
When this land enters, sacrifice it unless you tap an untapped permanent you control.
{T}: Add one mana of any color.",,,,,Edge of Eternities,2025-08-01,https://scryfall.com/card/eoe/252/command-bridge?utm_source=api
253,"Evendo, Waking Haven",,0.0,Land — Planet,mythic,,G,"This land enters tapped.
{T}: Add {G}.
Station (Tap another creature you control: Put charge counters equal to its power on this Planet. Station only as a sorcery.)
12+ | {G}, {T}: Add {G} for each creature you control.",,,,Station,Edge of Eternities,2025-08-01,https://scryfall.com/card/eoe/253/evendo-waking-haven?utm_source=api
254,Godless Shrine,,0.0,Land — Plains Swamp,rare,,"B, W","({T}: Add {W} or {B}.)
As this land enters, you may pay 2 life. If you don't, it enters tapped.",,,,,Edge of Eternities,2025-08-01,https://scryfall.com/card/eoe/254/godless-shrine?utm_source=api
255,"Kavaron, Memorial World",,0.0,Land — Planet,mythic,,R,"This land enters tapped.
{T}: Add {R}.
Station (Tap another creature you control: Put charge counters equal to its power on this Planet. Station only as a sorcery.)
12+ | {1}{R}, {T}, Sacrifice a land: Create a 2/2 colorless Robot artifact creature token, then creatures you control get +1/+0 and gain haste until end of turn.",,,,Station,Edge of Eternities,2025-08-01,https://scryfall.com/card/eoe/255/kavaron-memorial-world?utm_source=api
256,Sacred Foundry,,0.0,Land — Mountain Plains,rare,,"R, W","({T}: Add {R} or {W}.)
As this land enters, you may pay 2 life. If you don't, it enters tapped.",,,,,Edge of Eternities,2025-08-01,https://scryfall.com/card/eoe/256/sacred-foundry?utm_source=api
257,Secluded Starforge,,0.0,Land,rare,,,"{T}: Add {C}.
{2}, {T}, Tap X untapped artifacts you control: Target creature gets +X/+0 until end of turn. Activate only as a sorcery.
{5}, {T}: Create a 2/2 colorless Robot artifact creature token.",,,,,Edge of Eternities,2025-08-01,https://scryfall.com/card/eoe/257/secluded-starforge?utm_source=api
258,Stomping Ground,,0.0,Land — Mountain Forest,rare,,"G, R","({T}: Add {R} or {G}.)
As this land enters, you may pay 2 life. If you don't, it enters tapped.",,,,,Edge of Eternities,2025-08-01,https://scryfall.com/card/eoe/258/stomping-ground?utm_source=api
259,"Susur Secundi, Void Altar",,0.0,Land — Planet,mythic,,B,"This land enters tapped.
{T}: Add {B}.
Station (Tap another creature you control: Put charge counters equal to its power on this Planet. Station only as a sorcery.)
12+ | {1}{B}, {T}, Pay 2 life, Sacrifice a creature: Draw cards equal to the sacrificed creature's power. Activate only as a sorcery.",,,,Station,Edge of Eternities,2025-08-01,https://scryfall.com/card/eoe/259/susur-secundi-void-altar?utm_source=api
260,"Uthros, Titanic Godcore",,0.0,Land — Planet,mythic,,U,"This land enters tapped.
{T}: Add {U}.
Station (Tap another creature you control: Put charge counters equal to its power on this Planet. Station only as a sorcery.)
12+ | {U}, {T}: Add {U} for each artifact you control.",,,,Station,Edge of Eternities,2025-08-01,https://scryfall.com/card/eoe/260/uthros-titanic-godcore?utm_source=api
261,Watery Grave,,0.0,Land — Island Swamp,rare,,"B, U","({T}: Add {U} or {B}.)
As this land enters, you may pay 2 life. If you don't, it enters tapped.",,,,,Edge of Eternities,2025-08-01,https://scryfall.com/card/eoe/261/watery-grave?utm_source=api
267,Plains,,0.0,Basic Land — Plains,common,,W,({T}: Add {W}.),,,,,Edge of Eternities,2025-08-01,https://scryfall.com/card/eoe/267/plains?utm_source=api
269,Island,,0.0,Basic Land — Island,common,,U,({T}: Add {U}.),,,,,Edge of Eternities,2025-08-01,https://scryfall.com/card/eoe/269/island?utm_source=api
271,Swamp,,0.0,Basic Land — Swamp,common,,B,({T}: Add {B}.),,,,,Edge of Eternities,2025-08-01,https://scryfall.com/card/eoe/271/swamp?utm_source=api
273,Mountain,,0.0,Basic Land — Mountain,common,,R,({T}: Add {R}.),,,,,Edge of Eternities,2025-08-01,https://scryfall.com/card/eoe/273/mountain?utm_source=api
275,Forest,,0.0,Basic Land — Forest,common,,G,({T}: Add {G}.),,,,,Edge of Eternities,2025-08-01,https://scryfall.com/card/eoe/275/forest?utm_source=api
