collector_number,name,mana_cost,cmc,type_line,rarity,colors,color_identity,oracle_text,power,toughness,loyalty,keywords,set_name,released_at,scryfall_uri
141,Kavaron Turbodrone,{2}{R},3.0,Artifact Creature — Robot Scout,common,R,R,{T}: Target creature you control gets +1/+1 and gains haste until end of turn. Activate only as a sorcery.,2,3,,,Edge of Eternities,2025-08-01,https://scryfall.com/card/eoe/141/kavaron-turbodrone?utm_source=api
142,Lithobraking,{2}{R},3.0,Instant,uncommon,R,R,"Create a Lander token. Then you may sacrifice an artifact. When you do, Lithobraking deals 2 damage to each creature. (A Lander token is an artifact with ""{2}, {T}, Sacrifice this token: Search your library for a basic land card, put it onto the battlefield tapped, then shuffle."")",,,,,Edge of Eternities,2025-08-01,https://scryfall.com/card/eoe/142/lithobraking?utm_source=api
143,Melded Moxite,{1}{R},2.0,Artifact,common,R,R,"When this artifact enters, you may discard a card. If you do, draw two cards.
{3}, Sacrifice this artifact: Create a tapped 2/2 colorless Robot artifact creature token.",,,,,Edge of Eternities,2025-08-01,https://scryfall.com/card/eoe/143/melded-moxite?utm_source=api
144,Memorial Team Leader,{3}{R},4.0,Creature — Kavu Soldier,uncommon,R,R,"During your turn, other creatures you control get +1/+0.
Warp {1}{R} (You may cast this card from your hand for its warp cost. Exile this creature at the beginning of the next end step, then you may cast it from exile on a later turn.)",4,3,,Warp,Edge of Eternities,2025-08-01,https://scryfall.com/card/eoe/144/memorial-team-leader?utm_source=api
145,Memorial Vault,{3}{R},4.0,Artifact,rare,R,R,"{T}, Sacrifice another artifact: Exile the top X cards of your library, where X is one plus the mana value of the sacrificed artifact. You may play those cards this turn.",,,,,Edge of Eternities,2025-08-01,https://scryfall.com/card/eoe/145/memorial-vault?utm_source=api
146,Molecular Modifier,{2}{R},3.0,Creature — Kavu Artificer,uncommon,R,R,"At the beginning of combat on your turn, target creature you control gets +1/+0 and gains first strike until end of turn.",2,2,,,Edge of Eternities,2025-08-01,https://scryfall.com/card/eoe/146/molecular-modifier?utm_source=api
147,Nebula Dragon,{6}{R},7.0,Creature — Dragon,common,R,R,"Flying
When this creature enters, it deals 3 damage to any target.",4,4,,Flying,Edge of Eternities,2025-08-01,https://scryfall.com/card/eoe/147/nebula-dragon?utm_source=api
148,Nova Hellkite,{3}{R}{R},5.0,Creature — Dragon,rare,R,R,"Flying, haste
When this creature enters, it deals 1 damage to target creature an opponent controls.
Warp {2}{R} (You may cast this card from your hand for its warp cost. Exile this creature at the beginning of the next end step, then you may cast it from exile on a later turn.)",4,5,,"Flying, Haste, Warp",Edge of Eternities,2025-08-01,https://scryfall.com/card/eoe/148/nova-hellkite?utm_source=api
149,Orbital Plunge,{3}{R},4.0,Sorcery,common,R,R,"Orbital Plunge deals 6 damage to target creature. If excess damage was dealt this way, create a Lander token. (It's an artifact with ""{2}, {T}, Sacrifice this token: Search your library for a basic land card, put it onto the battlefield tapped, then shuffle."")",,,,,Edge of Eternities,2025-08-01,https://scryfall.com/card/eoe/149/orbital-plunge?utm_source=api
150,Oreplate Pangolin,{1}{R},2.0,Artifact Creature — Robot Pangolin,common,R,R,"Whenever another artifact you control enters, you may pay {1}. If you do, put a +1/+1 counter on this creature.",2,2,,,Edge of Eternities,2025-08-01,https://scryfall.com/card/eoe/150/oreplate-pangolin?utm_source=api
151,Pain for All,{2}{R},3.0,Enchantment — Aura,rare,R,R,"Enchant creature you control
When this Aura enters, enchanted creature deals damage equal to its power to any other target.
Whenever enchanted creature is dealt damage, it deals that much damage to each opponent.",,,,Enchant,Edge of Eternities,2025-08-01,https://scryfall.com/card/eoe/151/pain-for-all?utm_source=api
152,Plasma Bolt,{R},1.0,Sorcery,common,R,R,"Plasma Bolt deals 2 damage to any target.
Void — Plasma Bolt deals 3 damage instead if a nonland permanent left the battlefield this turn or a spell was warped this turn.",,,,Void,Edge of Eternities,2025-08-01,https://scryfall.com/card/eoe/152/plasma-bolt?utm_source=api
153,Possibility Technician,{2}{R},3.0,Creature — Kavu Artificer,rare,R,R,"Whenever this creature or another Kavu you control enters, exile the top card of your library. For as long as that card remains exiled, you may play it if you control a Kavu.
Warp {1}{R} (You may cast this card from your hand for its warp cost. Exile this creature at the beginning of the next end step, then you may cast it from exile on a later turn.)",3,3,,Warp,Edge of Eternities,2025-08-01,https://scryfall.com/card/eoe/153/possibility-technician?utm_source=api
154,Red Tiger Mechan,{3}{R},4.0,Artifact Creature — Robot Cat,common,R,R,"Haste
Warp {1}{R} (You may cast this card from your hand for its warp cost. Exile this creature at the beginning of the next end step, then you may cast it from exile on a later turn.)",3,3,,"Haste, Warp",Edge of Eternities,2025-08-01,https://scryfall.com/card/eoe/154/red-tiger-mechan?utm_source=api
155,Remnant Elemental,{1}{R},2.0,Creature — Elemental,uncommon,R,R,"Reach
Landfall — Whenever a land you control enters, this creature gets +2/+0 until end of turn.",0,4,,"Reach, Landfall",Edge of Eternities,2025-08-01,https://scryfall.com/card/eoe/155/remnant-elemental?utm_source=api
156,Rig for War,{1}{R},2.0,Instant,common,R,R,Target creature gets +3/+0 and gains first strike and reach until end of turn.,,,,,Edge of Eternities,2025-08-01,https://scryfall.com/card/eoe/156/rig-for-war?utm_source=api
157,Roving Actuator,{3}{R},4.0,Artifact Creature — Robot,uncommon,R,R,"Void — When this creature enters, if a nonland permanent left the battlefield this turn or a spell was warped this turn, exile up to one target instant or sorcery card with mana value 2 or less from your graveyard. Copy it. You may cast the copy without paying its mana cost.",3,4,,Void,Edge of Eternities,2025-08-01,https://scryfall.com/card/eoe/157/roving-actuator?utm_source=api
158,Ruinous Rampage,{1}{R}{R},3.0,Sorcery,uncommon,R,R,"Choose one —
• Ruinous Rampage deals 3 damage to each opponent.
• Exile all artifacts with mana value 3 or less.",,,,,Edge of Eternities,2025-08-01,https://scryfall.com/card/eoe/158/ruinous-rampage?utm_source=api
159,Rust Harvester,{R},1.0,Artifact Creature — Robot,rare,R,R,"Menace
{2}, {T}, Exile an artifact card from your graveyard: Put a +1/+1 counter on this creature, then it deals damage equal to its power to any target.",1,1,,Menace,Edge of Eternities,2025-08-01,https://scryfall.com/card/eoe/159/rust-harvester?utm_source=api
160,Slagdrill Scrapper,{R},1.0,Artifact Creature — Robot Scout,common,R,R,"{2}, {T}, Sacrifice another artifact or land: Draw a card.",1,2,,,Edge of Eternities,2025-08-01,https://scryfall.com/card/eoe/160/slagdrill-scrapper?utm_source=api
161,Systems Override,{2}{R},3.0,Sorcery,uncommon,R,R,"Gain control of target artifact or creature until end of turn. Untap that permanent. It gains haste until end of turn. If it's a Spacecraft, put ten charge counters on it. If you do, remove ten charge counters from it at the beginning of the next end step.",,,,,Edge of Eternities,2025-08-01,https://scryfall.com/card/eoe/161/systems-override?utm_source=api
162,"Tannuk, Steadfast Second",{2}{R}{R},4.0,Legendary Creature — Kavu Pilot,mythic,R,R,"Other creatures you control have haste.
Artifact cards and red creature cards in your hand have warp {2}{R}. (You may cast a card from your hand for its warp cost. Exile that permanent at the beginning of the next end step, then you may cast it from exile on a later turn.)",3,5,,,Edge of Eternities,2025-08-01,https://scryfall.com/card/eoe/162/tannuk-steadfast-second?utm_source=api
163,Terminal Velocity,{4}{R}{R},6.0,Sorcery,rare,R,R,"You may put an artifact or creature card from your hand onto the battlefield. That permanent gains haste, ""When this permanent leaves the battlefield, it deals damage equal to its mana value to each creature,"" and ""At the beginning of your end step, sacrifice this permanent.""",,,,,Edge of Eternities,2025-08-01,https://scryfall.com/card/eoe/163/terminal-velocity?utm_source=api
164,Terrapact Intimidator,{1}{R},2.0,Creature — Kavu Scout,uncommon,R,R,"When this creature enters, target opponent may have you create two Lander tokens. If they don't, put two +1/+1 counters on this creature. (A Lander token is an artifact with ""{2}, {T}, Sacrifice this token: Search your library for a basic land card, put it onto the battlefield tapped, then shuffle."")",2,1,,,Edge of Eternities,2025-08-01,https://scryfall.com/card/eoe/164/terrapact-intimidator?utm_source=api
165,Territorial Bruntar,{4}{R}{R},6.0,Creature — Beast,uncommon,R,R,"Reach
Landfall — Whenever a land you control enters, exile cards from the top of your library until you exile a nonland card. You may cast that card this turn.",6,6,,"Reach, Landfall",Edge of Eternities,2025-08-01,https://scryfall.com/card/eoe/165/territorial-bruntar?utm_source=api
166,Vaultguard Trooper,{4}{R},5.0,Creature — Kavu Soldier,uncommon,R,R,"At the beginning of your end step, if you control two or more tapped creatures, you may discard your hand. If you do, draw two cards.",5,5,,,Edge of Eternities,2025-08-01,https://scryfall.com/card/eoe/166/vaultguard-trooper?utm_source=api
167,Warmaker Gunship,{2}{R},3.0,Artifact — Spacecraft,rare,R,R,"When this Spacecraft enters, it deals damage equal to the number of artifacts you control to target creature an opponent controls.
Station (Tap another creature you control: Put charge counters equal to its power on this Spacecraft. Station only as a sorcery. It's an artifact creature at 6+.)
6+ | Flying",4,3,,Station,Edge of Eternities,2025-08-01,https://scryfall.com/card/eoe/167/warmaker-gunship?utm_source=api
168,Weapons Manufacturing,{1}{R},2.0,Enchantment,rare,R,R,"Whenever a nontoken artifact you control enters, create a colorless artifact token named Munitions with ""When this token leaves the battlefield, it deals 2 damage to any target.""",,,,,Edge of Eternities,2025-08-01,https://scryfall.com/card/eoe/168/weapons-manufacturing?utm_source=api
169,Weftstalker Ardent,{2}{R},3.0,Creature — Drix Artificer,uncommon,R,R,"Whenever another creature or artifact you control enters, this creature deals 1 damage to each opponent.
Warp {R} (You may cast this card from your hand for its warp cost. Exile this creature at the beginning of the next end step, then you may cast it from exile on a later turn.)",2,3,,Warp,Edge of Eternities,2025-08-01,https://scryfall.com/card/eoe/169/weftstalker-ardent?utm_source=api
170,Zookeeper Mechan,{1}{R},2.0,Artifact Creature — Robot,common,R,R,"{T}: Add {R}.
{6}{R}: Target creature you control gets +4/+0 until end of turn. Activate only as a sorcery.",1,3,,,Edge of Eternities,2025-08-01,https://scryfall.com/card/eoe/170/zookeeper-mechan?utm_source=api
171,Atmospheric Greenhouse,{4}{G},5.0,Artifact — Spacecraft,uncommon,G,G,"When this Spacecraft enters, put a +1/+1 counter on each creature you control.
Station (Tap another creature you control: Put charge counters equal to its power on this Spacecraft. Station only as a sorcery. It's an artifact creature at 8+.)
8+ | Flying, trample",5,4,,Station,Edge of Eternities,2025-08-01,https://scryfall.com/card/eoe/171/atmospheric-greenhouse?utm_source=api
172,Bioengineered Future,{1}{G}{G},3.0,Enchantment,rare,G,G,"When this enchantment enters, create a Lander token. (It's an artifact with ""{2}, {T}, Sacrifice this token: Search your library for a basic land card, put it onto the battlefield tapped, then shuffle."")
Each creature you control enters with an additional +1/+1 counter on it for each land that entered the battlefield under your control this turn.",,,,,Edge of Eternities,2025-08-01,https://scryfall.com/card/eoe/172/bioengineered-future?utm_source=api
173,Biosynthic Burst,{1}{G},2.0,Instant,common,G,G,"Put a +1/+1 counter on target creature you control. It gains reach, trample, and indestructible until end of turn. Untap it. (Damage and effects that say ""destroy"" don't destroy it.)",,,,,Edge of Eternities,2025-08-01,https://scryfall.com/card/eoe/173/biosynthic-burst?utm_source=api
174,Blooming Stinger,{1}{G},2.0,Creature — Plant Scorpion,common,G,G,"Deathtouch
When this creature enters, another target creature you control gains deathtouch until end of turn.",2,2,,Deathtouch,Edge of Eternities,2025-08-01,https://scryfall.com/card/eoe/174/blooming-stinger?utm_source=api
175,Broodguard Elite,{X}{G}{G},2.0,Creature — Insect Knight,uncommon,G,G,"This creature enters with X +1/+1 counters on it.
When this creature leaves the battlefield, put its counters on target creature you control.
Warp {X}{G} (You may cast this card from your hand for its warp cost. Exile this creature at the beginning of the next end step, then you may cast it from exile on a later turn.)",0,0,,Warp,Edge of Eternities,2025-08-01,https://scryfall.com/card/eoe/175/broodguard-elite?utm_source=api
176,Close Encounter,{1}{G},2.0,Instant,uncommon,G,G,"As an additional cost to cast this spell, choose a creature you control or a warped creature card you own in exile.
Close Encounter deals damage equal to the power of the chosen creature or card to target creature.",,,,,Edge of Eternities,2025-08-01,https://scryfall.com/card/eoe/176/close-encounter?utm_source=api
177,Diplomatic Relations,{2}{G},3.0,Instant,common,G,G,Target creature you control gets +1/+0 and gains vigilance until end of turn. It deals damage equal to its power to target creature an opponent controls.,,,,,Edge of Eternities,2025-08-01,https://scryfall.com/card/eoe/177/diplomatic-relations?utm_source=api
178,Drix Fatemaker,{3}{G},4.0,Creature — Drix Wizard,common,G,G,"When this creature enters, put a +1/+1 counter on target creature.
Each creature you control with a +1/+1 counter on it has trample.
Warp {1}{G} (You may cast this card from your hand for its warp cost. Exile this creature at the beginning of the next end step, then you may cast it from exile on a later turn.)",3,2,,Warp,Edge of Eternities,2025-08-01,https://scryfall.com/card/eoe/178/drix-fatemaker?utm_source=api
179,Edge Rover,{G},1.0,Artifact Creature — Robot Scout,uncommon,G,G,"Reach
When this creature dies, each player creates a Lander token. (It's an artifact with ""{2}, {T}, Sacrifice this token: Search your library for a basic land card, put it onto the battlefield tapped, then shuffle."")",2,2,,Reach,Edge of Eternities,2025-08-01,https://scryfall.com/card/eoe/179/edge-rover?utm_source=api
180,Eumidian Terrabotanist,{1}{G},2.0,Creature — Insect Druid,uncommon,G,G,"Landfall — Whenever a land you control enters, you gain 1 life.",2,3,,Landfall,Edge of Eternities,2025-08-01,https://scryfall.com/card/eoe/180/eumidian-terrabotanist?utm_source=api
181,Eusocial Engineering,{3}{G}{G},5.0,Enchantment,uncommon,G,G,"Landfall — Whenever a land you control enters, create a 2/2 colorless Robot artifact creature token.
Warp {1}{G} (You may cast this card from your hand for its warp cost. Exile this enchantment at the beginning of the next end step, then you may cast it from exile on a later turn.)",,,,"Warp, Landfall",Edge of Eternities,2025-08-01,https://scryfall.com/card/eoe/181/eusocial-engineering?utm_source=api
182,Famished Worldsire,{5}{G}{G}{G},8.0,Creature — Leviathan,mythic,G,G,"Ward {3}
Devour land 3 (As this creature enters, you may sacrifice any number of lands. It enters with three times that many +1/+1 counters on it.)
When this creature enters, look at the top X cards of your library, where X is this creature's power. Put any number of land cards from among them onto the battlefield tapped, then shuffle.",0,0,,"Ward, Devour",Edge of Eternities,2025-08-01,https://scryfall.com/card/eoe/182/famished-worldsire?utm_source=api
183,Frenzied Baloth,{G}{G},2.0,Creature — Beast,rare,G,G,"This spell can't be countered.
Trample, haste
Creature spells you control can't be countered.
Combat damage can't be prevented.",3,2,,"Haste, Trample",Edge of Eternities,2025-08-01,https://scryfall.com/card/eoe/183/frenzied-baloth?utm_source=api
184,Fungal Colossus,{6}{G},7.0,Creature — Fungus Beast,common,G,G,"This spell costs {X} less to cast, where X is the number of differently named lands you control.",5,5,,,Edge of Eternities,2025-08-01,https://scryfall.com/card/eoe/184/fungal-colossus?utm_source=api
185,Galactic Wayfarer,{2}{G},3.0,Creature — Human Scout,common,G,G,"When this creature enters, create a Lander token. (It's an artifact with ""{2}, {T}, Sacrifice this token: Search your library for a basic land card, put it onto the battlefield tapped, then shuffle."")",3,3,,,Edge of Eternities,2025-08-01,https://scryfall.com/card/eoe/185/galactic-wayfarer?utm_source=api
186,Gene Pollinator,{G},1.0,Artifact Creature — Robot Insect,common,G,G,"{T}, Tap an untapped permanent you control: Add one mana of any color.",1,2,,,Edge of Eternities,2025-08-01,https://scryfall.com/card/eoe/186/gene-pollinator?utm_source=api
187,Germinating Wurm,{4}{G},5.0,Creature — Plant Wurm,common,G,G,"When this creature enters, you gain 2 life.
Warp {1}{G} (You may cast this card from your hand for its warp cost. Exile this creature at the beginning of the next end step, then you may cast it from exile on a later turn.)",5,5,,Warp,Edge of Eternities,2025-08-01,https://scryfall.com/card/eoe/187/germinating-wurm?utm_source=api
188,Glacier Godmaw,{5}{G}{G},7.0,Creature — Leviathan,uncommon,G,G,"Trample
When this creature enters, create a Lander token. (It's an artifact with ""{2}, {T}, Sacrifice this token: Search your library for a basic land card, put it onto the battlefield tapped, then shuffle."")
Landfall — Whenever a land you control enters, creatures you control get +1/+1 and gain vigilance and haste until end of turn.",6,6,,"Trample, Landfall",Edge of Eternities,2025-08-01,https://scryfall.com/card/eoe/188/glacier-godmaw?utm_source=api
189,Harmonious Grovestrider,{3}{G}{G},5.0,Creature — Beast,uncommon,G,G,"Ward {2} (Whenever this creature becomes the target of a spell or ability an opponent controls, counter it unless that player pays {2}.)
Harmonious Grovestrider's power and toughness are each equal to the number of lands you control.",*,*,,Ward,Edge of Eternities,2025-08-01,https://scryfall.com/card/eoe/189/harmonious-grovestrider?utm_source=api
190,Hemosymbic Mite,{G},1.0,Creature — Mite,uncommon,G,G,"Whenever this creature becomes tapped, another target creature you control gets +X/+X until end of turn, where X is this creature's power.",1,1,,,Edge of Eternities,2025-08-01,https://scryfall.com/card/eoe/190/hemosymbic-mite?utm_source=api
191,Icecave Crasher,{3}{G},4.0,Creature — Beast,common,G,G,"Trample
Landfall — Whenever a land you control enters, this creature gets +1/+0 until end of turn.",4,4,,"Trample, Landfall",Edge of Eternities,2025-08-01,https://scryfall.com/card/eoe/191/icecave-crasher?utm_source=api
192,Icetill Explorer,{2}{G}{G},4.0,Creature — Insect Scout,rare,G,G,"You may play an additional land on each of your turns.
You may play lands from your graveyard.
Landfall — Whenever a land you control enters, mill a card.",2,4,,"Mill, Landfall",Edge of Eternities,2025-08-01,https://scryfall.com/card/eoe/192/icetill-explorer?utm_source=api
193,Intrepid Tenderfoot,{1}{G},2.0,Creature — Insect Citizen,common,G,G,{3}: Put a +1/+1 counter on this creature. Activate only as a sorcery.,2,2,,,Edge of Eternities,2025-08-01,https://scryfall.com/card/eoe/193/intrepid-tenderfoot?utm_source=api
194,Larval Scoutlander,{2}{G},3.0,Artifact — Spacecraft,uncommon,G,G,"When this Spacecraft enters, you may sacrifice a land or Lander. If you do, search your library for up to two basic land cards, put them onto the battlefield tapped, then shuffle.
Station (Tap another creature you control: Put charge counters equal to its power on this Spacecraft. Station only as a sorcery. It's an artifact creature at 7+.)
7+ | Flying",3,3,,Station,Edge of Eternities,2025-08-01,https://scryfall.com/card/eoe/194/larval-scoutlander?utm_source=api
195,Lashwhip Predator,{4}{G}{G},6.0,Creature — Plant Beast,uncommon,G,G,"This spell costs {2} less to cast if your opponents control three or more creatures.
Reach",5,7,,Reach,Edge of Eternities,2025-08-01,https://scryfall.com/card/eoe/195/lashwhip-predator?utm_source=api
196,Loading Zone,{3}{G},4.0,Enchantment,rare,G,G,"If one or more counters would be put on a creature, Spacecraft, or Planet you control, twice that many of each of those kinds of counters are put on it instead.
Warp {G} (You may cast this card from your hand for its warp cost. Exile this enchantment at the beginning of the next end step, then you may cast it from exile on a later turn.)",,,,Warp,Edge of Eternities,2025-08-01,https://scryfall.com/card/eoe/196/loading-zone?utm_source=api
197,Meltstrider Eulogist,{2}{G},3.0,Creature — Insect Soldier,uncommon,G,G,"Whenever a creature you control with a +1/+1 counter on it dies, draw a card.",3,3,,,Edge of Eternities,2025-08-01,https://scryfall.com/card/eoe/197/meltstrider-eulogist?utm_source=api
198,Meltstrider's Gear,{G},1.0,Artifact — Equipment,common,G,G,"When this Equipment enters, attach it to target creature you control.
Equipped creature gets +2/+1 and has reach.
Equip {5} ({5}: Attach to target creature you control. Equip only as a sorcery.)",,,,Equip,Edge of Eternities,2025-08-01,https://scryfall.com/card/eoe/198/meltstriders-gear?utm_source=api
199,Meltstrider's Resolve,{G},1.0,Enchantment — Aura,uncommon,G,G,"Enchant creature you control
When this Aura enters, enchanted creature fights up to one target creature an opponent controls. (Each deals damage equal to its power to the other.)
Enchanted creature gets +0/+2 and can't be blocked by more than one creature.",,,,"Fight, Enchant",Edge of Eternities,2025-08-01,https://scryfall.com/card/eoe/199/meltstriders-resolve?utm_source=api
200,Mightform Harmonizer,{2}{G}{G},4.0,Creature — Insect Druid,rare,G,G,"Landfall — Whenever a land you control enters, double the power of target creature you control until end of turn.
Warp {2}{G} (You may cast this card from your hand for its warp cost. Exile this creature at the beginning of the next end step, then you may cast it from exile on a later turn.)",4,4,,"Warp, Double, Landfall",Edge of Eternities,2025-08-01,https://scryfall.com/card/eoe/200/mightform-harmonizer?utm_source=api
201,Ouroboroid,{2}{G}{G},4.0,Creature — Plant Wurm,mythic,G,G,"At the beginning of combat on your turn, put X +1/+1 counters on each creature you control, where X is this creature's power.",1,3,,,Edge of Eternities,2025-08-01,https://scryfall.com/card/eoe/201/ouroboroid?utm_source=api
202,Pull Through the Weft,{3}{G}{G},5.0,Sorcery,uncommon,G,G,"Return up to two target nonland permanent cards from your graveyard to your hand, then return up to two target land cards from your graveyard to the battlefield tapped.",,,,,Edge of Eternities,2025-08-01,https://scryfall.com/card/eoe/202/pull-through-the-weft?utm_source=api
203,Sami's Curiosity,{G},1.0,Sorcery,common,G,G,"You gain 2 life. Create a Lander token. (It's an artifact with ""{2}, {T}, Sacrifice this token: Search your library for a basic land card, put it onto the battlefield tapped, then shuffle."")",,,,,Edge of Eternities,2025-08-01,https://scryfall.com/card/eoe/203/samis-curiosity?utm_source=api
204,Seedship Agrarian,{3}{G},4.0,Creature — Insect Scientist,uncommon,G,G,"Whenever this creature becomes tapped, create a Lander token. (It's an artifact with ""{2}, {T}, Sacrifice this token: Search your library for a basic land card, put it onto the battlefield tapped, then shuffle."")
Landfall — Whenever a land you control enters, put a +1/+1 counter on this creature.",3,3,,Landfall,Edge of Eternities,2025-08-01,https://scryfall.com/card/eoe/204/seedship-agrarian?utm_source=api
205,Seedship Impact,{1}{G},2.0,Instant,uncommon,G,G,"Destroy target artifact or enchantment. If its mana value was 2 or less, create a Lander token. (It's an artifact with ""{2}, {T}, Sacrifice this token: Search your library for a basic land card, put it onto the battlefield tapped, then shuffle."")",,,,,Edge of Eternities,2025-08-01,https://scryfall.com/card/eoe/205/seedship-impact?utm_source=api
206,Shattered Wings,{2}{G},3.0,Sorcery,common,G,G,"Destroy target artifact, enchantment, or creature with flying. Surveil 1. (Look at the top card of your library. You may put it into your graveyard.)",,,,Surveil,Edge of Eternities,2025-08-01,https://scryfall.com/card/eoe/206/shattered-wings?utm_source=api
207,Skystinger,{2}{G},3.0,Creature — Insect Warrior,common,G,G,"Reach
Whenever this creature blocks a creature with flying, this creature gets +5/+0 until end of turn.",3,3,,Reach,Edge of Eternities,2025-08-01,https://scryfall.com/card/eoe/207/skystinger?utm_source=api
208,Sledge-Class Seedship,{2}{G},3.0,Artifact — Spacecraft,rare,G,G,"Station (Tap another creature you control: Put charge counters equal to its power on this Spacecraft. Station only as a sorcery. It's an artifact creature at 7+.)
7+ | Flying
Whenever this Spacecraft attacks, you may put a creature card from your hand onto the battlefield.",4,5,,Station,Edge of Eternities,2025-08-01,https://scryfall.com/card/eoe/208/sledge-class-seedship?utm_source=api
